"Title","Content"
"Jumbe 16 Zitakazokufanya Ulie Baada ya Kuachana na Mpenzi Wako Ikiwa Ulimpenda kwa Dhati","Huwa ni vigumu zaidi kumsahau mpenzi wa zamani hasa ikiwa aliyekuaha ulimpenda kwa moyo wako wote

Kuna sababu nyingi sana za kuachana na mpenzi wako ikiwa ni pamoja na usaliti, kuchoka naye na kutokukujali na kukupenda kama zamani

Haijalishi imepita muda gani mwaka, mwezi, wiki au hata siku unaweza kujikuta unashindwa kumsahau kabisa mpenzi wako wa zamani kutokana na uzito wa uhusiano wenu

Mojawapo wa mambo magumu maishani ni mtu kushindwa kumsahau mpenzi wake wa zamani punde tu wanapoachana mara nyingi ikiwa walipendana kwa dhati.

Kuna sababu nyingi sana za kuachana na mpenzi wako ikiwa ni pamoja na usaliti, kuchoka naye na kutokukujali na kukupenda kama zamani. Picha: Pinterest

Chanzo: UGC

Jambo hili limewafanya watu wengi waendelee kuteseka na kujikuta wakishindwa kuendelea kabisa na maisha yao kawaida.

Kwa mara nyingi wapenzi wakikosana sio rahisi warudiane haraka na iwapo wanarudiana, inamaanisha kwamba wawili hao walikuwa bado wanapendana.

Kuna sababu nyingi sana za kuachana na mpenzi wako ikiwa ni pamoja na usaliti, kuchoka naye na kutokukujali na kukupenda kama zamani.

Haijalishi imepita muda gani mwaka, mwezi, wiki au hata siku unaweza kujikuta unashindwa kumsahau kabisa mpenzi wako wa zamani kutokana na uzito wa uhusiano wenu.

Hata hivyo TUKO.co.ke iliweza kukusanya baadhi ya jumbe za kuvunja moyo ambazo wapenzi huwa wanatumiana punde uhusiano wao wa kimapenzi unapokatika;

16. Poa kabisa, nafurahia kuachana na wewe kwa sababu nilikuwa na mwingine aliye bora kukuliko

15. Nilikuwa nimechoshwa na wewe, tafadhali niondokee

14. Nilikuwa nikisubiri sana siku kama hii ifike, nashukuru Mungu imefika

13. Hatimaye nimepata afueni, ulikuwa kizuizi kati yangu na Mungu wangu

12. Asante, nasikitika kukuarifu kwamba nilikuacha zamani sana

11. Unataka nifanyeje? Niandae sherehe?

10. Asante kwa kuniondolea mzigo wa mawazo kila mara

9. Kila la heri, tembea na Yesu

8. Vile unataka, ni vema uwe na raha

7.Samahani sikujua kwamba nilikuwa nikipoteza wakati wangu nikiwa na wewe

6. Sawasawa, kulikuwa na uhusiano wowote kati yetu?

5. Mimi nilikuacha zamani sana, nilikuwa naja kwako kwa ajili ya lishe

4. Ujumbe mtamu ambao nimekuwa nikiusubiri sana

3. Mbona ulikawia sana kuniambia ujumbe huu

2.Wewe sio wa kwanza

1. Sijatikisika, nakutakia kila la heri

Je, unayo taarifa ya kusisimua ambayo ungependa tuichapishe? Tafadhali, wasiliana nasi kupitia news@tuko.co.ke au WhatsApp: 0732482690.

MAKINIKA: Jinyakulie habari ZINAZOKUFAA ➡️ tafuta “IMEPENDEKEZWA KWA AJILI YAKO” na ufurahie!

Chanzo: TUKO.co.ke"
"Kalameni Aliyezuiwa Kuingia Basi na Mbuzi Wake Atumia Ujanja wa Kipekee Kumpeleka Nyumbani","Mwanamume mmoja kutoka Nigeria amesisimua watu kwa ujanja wake wa kumsafirisha mbuzi wake nyumbani baada ya kuzuiwa kuingia naye ndani ya basi

Katika picha hiyo, ingawa mwanamume huyo alikuwa ndani ya basi la umma, alimshika mbuzi huyo aliyekuwa nje kwa kamba

Mwanamume huyo alipanga kuburura mnyama huyo kwa kamba wakati gari likisonga, jambo ambalo lingemfanya mbuzi huyo kukimbilia wanakoenda

Mlofa mmoja ambaye alikuwa akisafiria kwa basi aliwavunja watu mbavu na mbinu yake ya kumsafirisha mbuzi wake nyumbani baada ya kuonywa kutongia na mnayama huyo ndani ya gari hilo.

Mwanamume atumia mbinu ya kipekee kusafirisha mbuzi wake. Picha: @kanifemachienti.

Chanzo: UGC

Katika picha iliyosambazwa na Kanife Machienti kwenye Facebook, mwanamume huyo alimshikilia mbuzi huyo kwa kamba nje akiwa ameketi ndani ya basi.

Alipanga kwamba wakati basi litaanza kusonga mbuzi huyo ataanza kukimbia kuelekea wanakokwenda, jambo ambalo liliwasisimua wengi mitandaoni.

Wwengi ambao walitoa maoni yao kuhusu kanda hiyo, walisema huenda mbuzi huyo angeibiwa kabla ya mwanamume huyo kufika anakoenda.

Itazame picha hiyo iliyoshirikiwa mitandoani na Kanife Machienti hapa

TUKO.co.ke ilikusanya baadhi ya maoni hapa chini:

Paul Uche alijibu:

""Baadhi ya watu na maoni yao ya kuchekesha. Unakula nyama na bado unapiga kelele za ukatili wa wanyama. Unafikiri nyama inatengenezwaje?""

Kunle Rabiu alisema:

""Kitendo cha uovu.""

Dinma Ebae pia alisema:

""Na wa o. Jamani mtaniua kabla ya siku zangu. Hili ni kosa.""

Daniel Ozioma aliandika

""Sijui mtu mwingine anasema nini ... hii ni makosa. Tunaua tu mbuzi moja kwa moja. Hatumtesi hadi kufa au kumwangalia akifa polepole, inachekesha lakini ni mbaya sana. Haihusiani na wewe kula mbuzi au jinsi nyama ya mbuzi inavyoingia kwenye sahani yako.""

Kwingineko, Huduma ya Polisi Kenya ililaani mwanamume mmoja na mhudumu wa pikipiki ambaye alinaswa kwenye kamera akisafirisha ndama.

Huduma ya polisi ilitaja hatua hiyo kama ya kutojali na ukatili kwa wanyama na ambayo inaadhibiwa na sheria.

Mamlaka ilisema wanyama wanapaswa kusafirishwa kwa njia iliyo salama na ya uangalifu mkubwa.

Read ENGLISH VERSION

Je, unayo taarifa ya kusisimua ambayo ungependa tuichapishe? Tafadhali, wasiliana nasi kupitia news@tuko.co.ke au WhatsApp: 0732482690.

MAKINIKA: Jinyakulie habari ZINAZOKUFAA ➡️ tafuta “IMEPENDEKEZWA KWA AJILI YAKO” na ufurahie!

Chanzo: TUKO.co.ke"
"Cheruiyot Kirui: Jumbe za Rambirambi Zamiminika Mfanyakazi wa Benki Akipatikana Amefariki","Safari ya Cheruiyot Kirui hadi kilele cha Mlima Everest ilitamatika kwa huzuni mnamo Alhamisi, Mei 23

Ilikuwa Mei 17 wakati Mkenya huyo alijikita kufuata ndoto yake ya kuukwea mlima mrefu zaidi duniani bila oksijeni ya ziada

Mfanyakazi huyo wa benki anayehudumu katika benki ya KCB aliripotiwa kutoweka baada ya kufaulu kufika mita 8,000 juu ya mlima huo

Cheruiyot Kirui, mfanyakazi wa benki moja nchini Kenya ambaye alitoweka alipokuwa akijaribu kuukwea Mlima Everest amefariki.

Mabaki ya Cheruiyot Kirui yaligunduliwa kwenye Mlima Everest baada ya kutoweka. Picha: Cheruiyot Kirui.

Chanzo: Facebook

Everest Today ilitangaza habari za kufariki kwa Cheruiyot siku ya Alhamisi, Mei 23.

Kulingana na uchapishaji huo, mabaki yake yalipatikana mita chache chini ya eneo la mkutano.

""Alikuwa kwenye dhamira ya kuthubutu kufika kileleni bila oksijeni ya ziada na aliandamana na mtaalam wa milima Nepal Nawang Sherpa, ambaye hatima yake bado haijajulikana.

Nia yake isiyoweza kuepukika na shauku yake ya kupanda mlima itakuwa msukumo milele. Tunatuma rambirambi zetu za dhati kwa familia na marafiki zake katika kipindi hiki cha majonzi. Pumzika kwa amani, Cheruiyot,"" chapisho hilo lilisema.

Habari za kifo chake ziliibua jumbe za rambirambi kutoka kwa Wakenya kwenye mitandao ya kijamii.

Aikoni ya Bomet:

""Rais anapaswa kuzingatia kutupa likizo ya kuomboleza Cheruiyot.""

Hussein Hursa:

""Nimetuma salamu zangu za rambirambi kwa familia yake.""

Kadizma Amoh:

“Sijui niseme nini. Pole zangu za dhati kwa familia. RIP.”

Merab Akello Ayieko:

""Shujaa, pumzika kwa urahisi.""

Sophie Oyaro:

“Inasikitisha. Roho yake ipumzike amani.”

Agnetta Tasha Mwangi:

""Inasikitisha sana. Pumzika kwa amani ya milele bingwa.""

Ayuma Ouma:

""Hizi ni habari za kusikitisha. Kwa urefu kama huu ni muhimu kuwa salama kwanza. Pumzika kwa urahisi.""

Je, Cheruiyot Kirui alipotea vipi akiwa Mlima Everest?

Kulingana na waandalizi wa msafara huo, Kirui na mwelekezi wake walipotea katika eneo la 'death zone' (zaidi ya mita 8,000) kwenye Everest mnamo Jumatano, Mei 22.

Akizungumza na gazeti la Himalayan Times, mwenyekiti wa Seven Summit Treks Mingma Sherpa alisema waandalizi walipoteza mawasiliano na Kirui katika Bishop Rock, mita chache tu chini ya mkuano.

Sherpa alisema Seven Summit Treks imewatuma waokoaji wawili kumtafuta Kirui na mwelekezi.

Wakizungumzia habari za kutoweka kwa Kirui, wanamtandao waliwataka Wakenya kumuombea apatikane akiwa salama.

Read ENGLISH VERSION

Je, unayo taarifa ya kusisimua ambayo ungependa tuichapishe? Tafadhali, wasiliana nasi kupitia news@tuko.co.ke au WhatsApp: 0732482690.

MAKINIKA: Jinyakulie habari ZINAZOKUFAA ➡️ tafuta “IMEPENDEKEZWA KWA AJILI YAKO” na ufurahie!

Chanzo: TUKO.co.ke"
"Cheruiyot Kirui: Jinsi Mfanyakazi Jasiri wa Benki Alijiandaa Kuukwea Mlima Everest Bila Oksijeni","Cheruiyot Kirui aliweka mipango ya kina katika jaribio lake la kufika kilele cha Mlima Everest bila oksijeni ya ziada

Aliwekeza kisi kikubwa cha pesa, akieleza kwamba vifaa alivuonunua vingemfaa ikiwa ataanguka au kuugua ghafla

Kirui aliahidi kuwasasisha wafuasi wake jinsi mambo yalivyo, lakini alipoteza maisha yake mlimani

Kupanga kilele cha mlima, hasa ulio juu zaidi kama Everest, kunahitaji maandalizi ya kina.

Kwa kipenzi wa milima na mandhari Cheruiyot Kirui, kufanya hivyo bila oksijeni ya ziada kulimaanisha alijiandaa mara mbili zaidi.

Mtazamo wa kina kupitia mtandao wake wa kijamii unaonyesha hatua maalum alizochukua ili kufanikiwa kukwea kwake bila oksijeni.

Katika chapisho lake la mwisho la Instagram, Kirui alionyesha kuwa alijua hatari, lakini mwili wake ulikuwa tayari.

""Bila oksijeni, mtu huathirika zaidi na baridi. Kwa hiyo nina jozi ya glavu za joto na mittens yenye joto na seti ya ziada ya betri,"" aliandika.

Kipimo cha pili kilikuwa na Nifedipine ya dharura kutokana na kwamba alikuwa kwenye hatari ya HAPE (High Altitude Pulmonary Edema).

""Kwa HACE, nina Dexamethasone na Acetazolamide,"" alielezea, akiongeza kuwa Manaslu alimfundisha nini maana ya kuwa na kipindi kisicho na dawa.

Kuhusu oksijeni, ambayo ilikuwa maandalizi ya tatu, Kirui alibainisha kuwa Nawang Sherpa angesafirisha chupa ya dharura ya oksijeni kutumika iwapo ataanguka.

Vile vile vingefaa ikiwa angeishiwa na wakati, hali ya hewa ikawa mbaya, au mwili wake ulifikia kikomo.

Jambo la nne lilikuwa ufichuzi wake kwamba alipanga kupanda mlima kutoka upande wa Tibet/Kaskazini ili kuepuka msongamano wa magari.

Maandalizi ya tano ya Kirui yalihusisha kuwekeza kimwili, kiakili na kwa wakati.

Huku kila kitu kikiwa sawa, alianza safari ambayo ingempeleka tena kwenye kile alichopenda kufanya kawaida.

""Msafara huu unachukua zaidi ya mwezi mmoja,"" alibainisha, akiongeza kuwa kiasi cha pesa alichotumia kilikuwa kikubwa.

Kirui alitania kwamba atalazimika kutangaza ameishiwa apewe msaada atakapotua tena Kenya, lakini alikuwa ameelekeza macho yake katika kufanikisha hilo.

Mtafutaji wa msisimko huyo aliahidi kurejea kwenye jukwaa na kuwajulisha wafuasi wake jinsi mambo yalivyokwenda.

Hata hivyo, habari za kusikitisha ni kwamba Kirui hakurejea akiwa hai tena, kwani mwili wake ulipatikana karibu na kilele.

Read ENGLISH VERSION

Je, unayo taarifa ya kusisimua ambayo ungependa tuichapishe? Tafadhali, wasiliana nasi kupitia news@tuko.co.ke au WhatsApp: 0732482690.

MAKINIKA: Jinyakulie habari ZINAZOKUFAA ➡️ tafuta “IMEPENDEKEZWA KWA AJILI YAKO” na ufurahie!

Chanzo: TUKO.co.ke"
"Binti Mkenya Aliyenusurika Ajalini Awa Mwafrika wa Kwanza Mwanamke Kuendesha Tramu, Qatar","Ann Mariba alikua na hali ya kutojikubali kwa sababu alizaliwa na tatizo la kigugumizi na alilelewa katika nyumba ya hali ya chini

Hata hivyo, hilo halikumzuia kufikia ndoto zake licha ya kuwa mama katika umri mdogo

Alihamia Qatar na kuweka historia ya kuwa mwanamke wa kwanza Mwafrika dereva wa tramu huko Lusail

Ann Mariba, anayejulikana kwa jina la kipenzi Hopeoftomorrow, ni msanii wa injili wa Kenya mwenye umri wa miaka 38 aliyezaliwa upya.

Mariba (r) alitoka kwenye eneo la ajali bila majeraha makubwa. Picha: Alstom/Ann Mariba.

Chanzo: UGC

Mama huyo singo, mwenye mtoto mvulana wa umri wa miaka 22, aliambia TUKO.co.ke kwamba alilelewa katika familia ya Kikristo ya ndugu wanne: yeye na kaka zake watatu.

Je, kazi ya kwanza ya Mariba ilikuwa ipi?

Alifichua kuwa familia yake haikuwa na uwezo mzuri wa kifedha, kwa hivyo hakusoma kwa kiwango alichofikiria.

MAKINIKA: Watumie wahariri wetu taarifa yako unayoiona kuwa bora! Tafadhali wasiliana nasi kupitia news@tuko.co.ke au WhatsApp: 0732482690.

Akiwa na mtoto na familia ya kutunza, alitafuta malisho ya kijani kibichi nje ya nchi na kuhamia Qatar mnamo 2015. Kazi yake ya kwanza ilikuwa kama msichana wa chai.

Kwa miaka mingi, alijenga ujuzi mpya na kuhamia huduma kwa wateja kabla ya kupata kazi kama dereva wa kwanza wa tramu wa kike Mwafrika huko Lusail.

""Nimeonewa, nimekataliwa na kuachwa na marafiki, familia na wafanyakazi wenzangu. Niliambiwa sitapandishwa cheo kwa sababu nina kigugumizi,"" alikumbuka.

Mariba inamsifu Mungu kupitia muziki

Wakati tu mambo yalionekana kumwendea sawa, Mariba alinusurika kifo kwa kutumia ndevu aliponusurika kwenye ajali.

Alikumbuka tukio hilo alipokuwa akingoja kwenye T Junction akielekea nyumbani kutoka kwenye ushirika wa kanisa.

""Ilitokea Aprili mwaka huu. Nilisikia tu mtafaruku, siwezi kusema ni nini hasa kilitokea. Kwa bahati nzuri, sikupata jeraha lolote au kuvunjika,"" alikumbuka, akishiriki picha za ajali aliyotoka.

Baada ya kuinuka kutoka kwenye nyasi hadi kwenye neema na kumtazama Mungu akimkinga na kifo kilichokaribia, Mariba alichagua kumsifu Yeye kupitia muziki wa injili.

Kulingana naye, alishinda changamoto zote kwa sababu ulimwengu ulifunua kwamba kulikuwa na ukuu ndani yake, kama inavyoelezwa katika Biblia katika Yoshua 1:9.

""Nimetayarisha nyimbo 10 kufikia sasa, zilizorekodiwa kwa Kiingereza, Kiswahili, na Gikuyu. Nane ziko kwenye YouTube, lakini mbili bado hazijatolewa. Moja ni Goocai Jehova, nyingine inaitwa Gikombe,"" alisimulia.

Mariba anaangalia nyuma mwanzo wake mnyenyekevu, anakaribia kufa, na hali yake ya sasa na anamshukuru Mungu kwa kuwa nguvu yake anapovunjika.

Mwanamke kutoka Uasin Gishu awa mwimbaji wa nyimbo za Injili nchini Qatar

Katika hadithi nyingine ya kutia moyo, familia ya Clare Vusha ilipitia huzuni isiyoelezeka baada ya kuwapoteza kaka watatu kwa kufuatana, mdogo zaidi wa miaka 11.

Huzuni iliwakumba wazazi wake, jambo ambalo lilimfanya binti huyo mwenye huruma kutambua kwamba alihitaji kuwa nguzo ya matumaini.

Licha ya kuishi nchini Qatar, nchi yenye Waislam wengi, alijitosa katika muziki wa injili na kuwa jina maarufu.

Read ENGLISH VERSION

Je, unayo taarifa ya kusisimua ambayo ungependa tuichapishe? Tafadhali, wasiliana nasi kupitia news@tuko.co.ke au WhatsApp: 0732482690.

MAKINIKA: Jinyakulie habari ZINAZOKUFAA ➡️ tafuta “IMEPENDEKEZWA KWA AJILI YAKO” na ufurahie!

Chanzo: TUKO.co.ke"
"Naibu Chansela Chuo Kikuu cha Nairobi Stephen Kiama Anayekabiliwa na Utata Alazimishiwa Likizo Tena","Naibu Chansela wa Chuo Kikuu cha Nairobi Stephen Kiama hapo awali, Aprili 19, alitumwa kwa likizo ya lazima

Baraza la chuo kikuu mnamo Jumatano, Mei 22, lilitoa taarifa nyingine na kutangaza kwamba Kiama anatumwa likizo

Baraza hilo lilisema kuwa likizo yake ya lazima inatokana na tuhuma za ubadhirifu wa rasilimali za chuo kikuu

Naibu Chansela wa Chuo Kikuu cha Nairobi Stephen Kiama ametumwa kwa likizo ya lazima tena, takriban mwezi mmoja baada ya kupuuza agizo sawia kutoka kwa baraza la taasisi hiyo.

Naibu Chansela wa Chuo Kikuu cha Nairobi Stephen Kiama anatumwa kwa likizo ya lazima. Picha: Mswakiii

Chanzo: Twitter

Chuo kikuu kilishikilia uamuzi iliofanya Ijumaa, Aprili 19, kupeleka Kiama likizo.

Baraza la chuo hicho pia lilitoa agizo linalomtaka Ayub Njoroge Gitau kuendelea kuhudumu kama kaimu naibu-chansela wa taasisi hiyo.

Kwa nini Stephen Kiama anapelekwa likizo?

Kulingana na taarifa iliyoonekana na TUKO.co.ke, mwenyekiti wa baraza hilo Amukowa Anagwe alisema Kiama anatumwa likizo kutokana na madai ya ubadhirifu wa rasilimali za taasisi hiyo na vitisho vya wafanyikazi.

""Baraza lingependa kufahamisha jumuiya ya chuo kikuu na watu wote wanaohusika kwamba uamuzi uliotolewa Aprili 19 wa kumpa Profesa Stephen Kiama Gitahi kuondoka mara moja unasalia kutekelezwa,"" Anangwe alisema.

Baraza pia liliazimia kutoa barua mpya za kuidhinisha utendakazi wa majukumu katika nyadhifa 24 za utawala.

""Uhamisho wa watumishi wote uliotekelezwa kutokana na kesi iliyotajwa hapo juu na kinyume na azimio la Baraza unatenguliwa na watumishi wote walioathirika wanaelekezwa kurejea vituoni na nyadhifa zao za awali mara moja bila kizuizi chochote.""

VC Stephen Kiama apuuzilia mbali madai eti anaenda likizo

Kiama alikuwa amepuuza habari za kuondoka kwake.

Katika mawasiliano yaliyoshirikishwa na Kiama, alitoa wito kwa jumuiya ya chuo kikuu na wanafunzi kupuuza na kuzingatia ustawi wa kubadilisha chuo kikuu ili kudumisha kiwango cha kimataifa.

Kulingana na risala hiyo, baraza la chuo hicho chini ya mwenyekiti Anangwe, lilihimiza Kiama kuendelea na likizo kuanzia Ijumaa, Aprili 19.

Kiama alitupilia mbali taarifa hiyo, akisema kuwa mkuu wa ofisi kwa sasa, aliyechaguliwa na wajumbe wa kitivo, hawezi kuteuliwa kuwa VC.

Baraza lilimteua Ayub Njoroge, mkuu wa sasa, kuwa kaimu makamu wa chansela.

Read ENGLISH VERSION

Je, unayo taarifa ya kusisimua ambayo ungependa tuichapishe? Tafadhali, wasiliana nasi kupitia news@tuko.co.ke au WhatsApp: 0732482690.

MAKINIKA: Jinyakulie habari ZINAZOKUFAA ➡️ tafuta “IMEPENDEKEZWA KWA AJILI YAKO” na ufurahie!

Chanzo: TUKO.co.ke"
"Siri 17 Ambazo Mwanamke Anafaa Kuweka Hadi Kifo Ili Kulinda Uhusiano au Ndoa Yake","Wengi wanaamini kuwa uaminifu ndio nguzo ya uhusiano dhabiti na ni kweli, lakini kuna tofauti kidogo kati ya uaminifu na kufichua mambo yako yote.

Tunavyojua maisha yana mambo mengi ya kukanganya na magumu pia.

Kuna mambo ambayo wewe kama mwanamke ukiwambia mpenzio, huenda uhusiano wako usisalie dhabiti au usambaratike kabisa. Picha: UGC

Chanzo: Twitter

Kila mtu anajitambua mwenyewe. Hakuna aliye mkamilifu. Kuna mambo ambayo ni vyema kuyafichua n kuna yale mtu hafai kuyaweka wazi.

Haya ndio mambo ambayo wanawake wanastahili kuyaweka siri katika uhusiano wao.

1. Hofu kuhusu uhusiano wako

Katika kila uhusiano, uwe wa karibu au wa mbali, kuna mambo unayoyashuku, hisia zisizokufurahisha na maswali mengi.

Ni vyema kutosema na mpenzi wako kuhusu maswala hayo ikiwa sio za maana sana kwa kuwa zinaumiza mioyo na kusambaratisha uaminifu wengi.

Mambo hayo huenda yakapotea tu baada ya muda.

2. Jinsi unavyotumia pesa zako

Pesa husababisha ndoa nyingi kuvunjika. Ni vyema kumfungulia mpenzio akaunti yake ya benki na kutafuta pesa zako.

Ni vyema kujivinjari, mradi tu pesa unazotumia zisihitilafiane na pesa za matumizi nyumbani.

3. Siri za ndani za kifamilia

Haina maana kumwambia mpenzi wako kuhusu babako anafanya dhuluma nyingi nyumbani au mamako asiyejukumika ipasavyo.

Ukimwambia mpenzi wako mambo ya ndani kihistoria ya familia yako, utakuwa unampa silaha dhidi yako na usishtuke siku moja ukiambiwa “Babako alimdanganya mamako pia na mpenzi mwingine”.

4. Kuavya mimba

Hakuna mwanamume anayetaka kumuoa msichana aliyeavya mimba mara kadhaa.

Wakiamua kuyapuuza, wanakuwa wepesi wa kulaumu wakichelewa kupata mtoto.

5. Marafiki waliokuzingua

Kumfanya mpenzi wako ajue marafiki waliokuzingua kunamfanya mpenzi wako kutokuamini.

Wanaume sawia na wanawake hawapendi kujua kuwa rafiki anaenziwa na mpenzi wake wa maisha.

Wakati mwingi, wao huwafukuza marafiki wa wapenzi wao kwa kukosa uaminifu.

6. Kuwaarifu mashemeji mambo ya uhusiano wenu

Kueneza habari zenu nje, hasa kwa jamaa na mashemeji huharibu mambo. Hali hiyo inaweza kusambaratisha uhusiano wenu ikiwa mume wako anamwamini na anamuenzi jamaa husika katika familia yenu.

7. Kitu ambacho hupendi kumhusu mpenzio

Hakuna aliye mkamilifu. Ikiwa hulipendi pua lake, nywele, … chochote kile, usimwambie. Angalia uzuri wake na kumsifia kwa hayo.

8. Maoni mabaya

Usimwambie hisia mbaya kumhusu kutoka kwa marafiki na jamaa. Mambo hayo yatamuumiza anaweza kuyatumia kudai jamaa wa familia yako hawakumpenda.

Dunia ina mambo mabaya, mkinge mpenzio kwa mapenzi tele

9. Kuchunguza anaowasiliana nao

Wanawake wengi hupenda kujua mpenzi wao anawasiliana na akina nani kwa simu, hali inayowafanya kuvizia simu zao.

Utaonekana mtu asiyemwamini. Akiacha simu yake nyumbani, kuwa mwaminifu na usipekue

10. Jumbe za mpenzi wa zamani

Ikiwa unazungumza na mpenzi wako wa zamani, usimuonyeshe au kumwacha aone jumbe hizo. Acha jumbe hizo ziwe zako pekee.

Sio wanaume wengie wanaoweza kuishi wakijua jambo hilo linafanyika.

11. Ikiwa umewahi kudanganya

Kila mtu ameteleza kwa wakati mmoja, lakini kuwa makini na maneno unayomwambia mpenzi wako kwa kuwa huenda yakapanda mbegu akilini mwao na kuwageuza kuwa watu tofauti kabisa.

12. Mahaba ya zamani

Usilizungumzie hili. Usiulize wala kulizungumzia, labda tu likichipuka kwenye mazungumzo.

Wataalamu wanasema kuwa kuzungumzia mahaba ya zamani na mpenzi wako wa sasa hakutakusaidia.

13. Mahusiano ya pembeni kazini

Ikiwa ulikubali mahaba na mtu ofisini, usilizungumzie na mpenzi wako.

Ukifanya hivyo, utavunja uaminifu kwa mpenzi wako kwa kuwa sio rahisi kusahau jambo kama hilo.

14. Mtu anayekuzingua

Sio lazima mpenzi wako ajue hisia zako kwa mtu fulani. Ikiwa itakuwa una hisia kwa ndugu yake au marafiki zake na umwambie, hali itakuwa mbaya

15. Kumlinganisha na mpenzi wako wa zamani

Wazo la kumlinganisha mpenzi wako na yule wa zamani sio la busara. Hata ikiwa una hasira, usifanye hivyo.

16. Uroda hauna raha tena

Ikiwa mahaba yenu kitandani yamepungua asali, ni jukumu lenu wawili kuyaimarisha. Myazungumzi hasa mbinu mpya kuimarisha mapenzi yenu.

Hakuna anayetaka kusikia “Sidhani nina hamu yako tena”.

17. Ngono nzuri zaidi

Ikiwa uroda uliokuzingua sana haukuwa kutoka kwa mpenzi wako wa sasa, usilizungumzie, au sivyo utajitia matatani.

Mpenzio anataka kujua yeye ndiye giji kitandani. Mfanye ajue hiyo au sivyo, utahangaika kwa taabu za kujitakia.

Je, unayo taarifa ya kusisimua ambayo ungependa tuichapishe? Tafadhali, wasiliana nasi kupitia news@tuko.co.ke au WhatsApp: 0732482690.

MAKINIKA: Jinyakulie habari ZINAZOKUFAA ➡️ tafuta “IMEPENDEKEZWA KWA AJILI YAKO” na ufurahie!

Chanzo: TUKO.co.ke"
"Vyakula 10 vinavyoongeza nguzu za ubongo na uwezo wa kukumbuka","-Ubongo ni muhimu sana kwa mwili na maisha ya binadamu

-Ubongo ndio unahakikisha viungo muhimu vya mwili kama vile moyo na mapafu vinafanya kazi ipasavyo

Ubongo ni muhimu sana kwa afya ya mwanadamu na hivyo ni muhimu kuhakikisha kiungo hicho cha mwili kinapata virutubisho vifaavyo.

Wengi wanahusisha ubongo na werevu wa mtu, lakini ubongo unafanya kazi kuhakikisha kuwa mwili wa mtu unaendesha shughuli zake ipasavyo.

Tuma neno ‘NEWS’ kwa 40227 ili kupata habari muhimu pindi zinapochipuka

Habari Nyingine: Jamaa atumia gari aina ya BMW kama jeneza kumzika babake

Ubongo huongoza kufanya kazi na kusonga kwa viungo vya mwili, mawazo, kumbukumbu za akilini na kuhakikisha viungo vya mwili vinafanya kazi ipasavyo kwa uwiano na ushirikiano unaostahili.

Hivi ni baadhi ya vyakula 10 ambavyo vitakuhakikishia kuwa unaboresha uwezo wa kukumbuka na kujituma katika shughuli zinazohitahi kufikiria.

Habari Nyingine: Orodha ya nchi zinazoogoza kwa umasikini duniani, Kenya yatajwa

1. Samaki

Samaki kama vile salmon, trout na sardines vina virutubisho vya aside ya mafuta vya omega-3.

Karibu 60% ya ubongo wa binadamu ni mafuta; na nusu ya mafuta hayo ni aina ya omega-3.

Ubongo wa binadamu hutumia omega-3 kutengeneza seli mpya za neva. Mafuta hayo ni muhimu kwa kumwezesha mtu kujifunza kitu na kukumbuka.

2. Kahawa

Iwapo unakunywa kahawa asubuhi, utafurahia kusikia kuwa inakufaa.

Viungo viwili vya kahawa- kafeini na chembechembe za molekuli zinazosaidia kuzuia mchanganyo wa kemikali zinazoweza kuharibu seli za mwili, kwa kimombo anti-oxidants vinasaidia ubongo wako.

Pia kahawa inachangamsha na kuongeza viwango vya kemikali kwa jina serotonin inayomfanya mtu kujihisi akiwa na furaha.

3. Buluuberi

Matunda ya buluuberi yana viungo vya anthocyanins. kirutubisho hicho huusaidia ubongo kukuza seli mpya na kuukinga dhidi ya maradhi ya ubongo.

Habari Nyingine: Video ya mwanamke Mkenya akiteswa Lebanon yakasirisha wengi

4. Bizari manjano (Turmeric)

Kiungo cha curcumin kinachopatikana kwa bizari manjano kimethibitishwa kufaidi seli za ubongo, kupunguza msongo wa mawazo na kuboresha uwezo wa kukumbuka.

5. Broccoli

Broccoli ina viungo muhimu ikiwemo vinavyosaidia mwili kutoa sumu. Aidha, mboga hii imesheheni vitamini K ambayo utafiti umeonyesha huchangia kuboresha uwezo wa kukumbuka.

6. Chai ya kijani kibichi (Green Tea)

Viungo vya caffeine vya L-Theanine vinavyopatikana katika chai hii vinamsaidia mtu kujihisi akiwa mtulivu.

7. Chokoleti nyeusi

ChokolEti ina viungo vya flavonoids ambavyo ni muhimu kuboresha eneo la ubongo linalohusika na kukumbuka.

Pia ina viungo vya caffeine na kwa kuzuia mchanganyo wa kemikali unaoweza kuziathiri seli, yaani anti-oxidants vinavyochangamsha na kuzuia kuboronga kwa ubongo.

Habari Nyingine: Wakili anaswa akitazama video 'chafu' mahakamani, jionee

8. Njugu

Aina za njugu kama vile jozi, hazeli na lozi zimesheheni vitamini E na vitamini za kundi la B ambazo ni muhimu kwa kuboresha afya ya ubongo.

Vitamini E husadia ubongo wa mtu kuweza kuelewa lugha na mazungumzo pamoja kuweza kuzungumza.

9. Machungwa

Machungwa yana vitamini C ambayo ni vitamini muhimu katika kuzuia kudumaa kwa ubongo na kukua kwa seli zake.

Machungwa yana kemikali ya flavanones ambayo husaidia kuimarisha ubongo wa mtu kukumbuka mambo upesi

Habari Nyingine: Mwanamume amnunulia Samantha wake gari la KSh 2 milioni

10. Mayai

Mayai yana virutubisho muhimu vya ubongo ikiwemo vitamini B6 na B 12, folate na choline.

Mayai yana vitamini D ambayo ni muhimu kwa afya ya ubongo.

Una taarifa motomoto au sakata ambayo ungependa tuichapishe? Wasiliana nasi kwa news@tuko.co.ke, mwangi.muraguri@tuko.co.ke , kwenye WhatsApp: 0732482690 na kwenye Telegram: Tuko News

Jinsi ya kupika mandani za mpishi Rachel | TUKO TV

Chanzo: TUKO.co.ke"
