"Title","Content"
"Anne Waiguru Amrarua Gachagua Huku Vuta N'kuvute Ikitikisa Mlima Kenya: ""Kila Mtu Anaweza Kuota""","Gavana Anne Waiguru alimshutumu Naibu Rais Rigathi Gachagua kwa madai ya kujaribu kubinafsisha afisi yake

Gavana huyo wa awamu ya pili aliteta kuwa wenye afisi za umma wanazishikilia kwa uaminifu na sio wamiliki

Waiguru, ambaye wachanganuzi wanasema huenda anawania nafasi ya naibu rais 2027, alisema kila Mkenya, wakiwemo wanawake na vijana, ana haki ya kuwa na ndoto ya kushikilia afisi kuu

Gavana wa Kirinyaga Anne Waiguru amemkemea Naibu Rais Rigathi Gachagua huku kukiwa na madai ya kushindwa katika Muungano wa Kwanza wa Kenya.

Anne Waiguru alisema kila Kenya ina haki ya kuwa na ndoto. Picha: Anne Waiguru/Rigathi Gachagua.

Chanzo: UGC

Katika taarifa ya Jumatatu, Mei 20, Waiguru alisema maafisa wa umma kama wale wanaoshikilia wadhifa wa naibu rais hawafai kubinafsisha afisi zao.

Ujumbe wa Anne Waiguru kwa Gachagua

Katika shambulio lisilo la moja kwa moja dhidi ya Gachagua na washirika wake, Waiguru alisema ni makosa kuifanya ionekane kuwa mwiko kwa mtu mwingine yeyote kutamani kuwa naibu wa rais.

""Pamoja na kwamba tunaheshimu ofisi ya Naibu Rais, na kwa kweli ofisi nyingine yoyote ya uongozi, demokrasia ya kimaendeleo haituruhusu sisi wakaaji wa ofisi za uongozi wa umma kuzibinafsisha kiasi kwamba inakuwa mwiko kwa mtu mwingine yeyote kulea na kueleza azma yake. kuzichukua. Tunashikilia afisi hizi kwa uaminifu, sio kama wamiliki,"" Waiguru alisema.

Gavana huyo wa muhula wa pili, ambaye wachambuzi wanasema huenda akawa anawania nafasi ya DP mwaka wa 2027, alisema kila Mkenya, wakiwemo wanawake na vijana, ana haki ya kutekeleza ndoto zao za kushikilia wadhifa wowote nchini.

Alisema wanawake na vijana wanastahili kukuzwa ili kutimiza ndoto yao ya kushikilia afisi za juu, sio uadui kutoka kwa wenye ofisi kwa sasa.

""Tutambue haki ya wote, hasa wanawake na vijana wetu, kutamani vyeo vya juu. Tushikane mikono katika uongozi wa kisiasa na kijamii na kiuchumi. Kila mtu ana haki ya kuota na kutimiza ndoto zake kama walivyoota uongozi wa sasa. , na ndoto zao zinatimizwa kwa uungwaji mkono wa mamilioni ya vijana na wanawake Wao, pia, wanastahili kuungwa mkono, wala si uadui, Tunatumahi kuwa sote tunatafuta kilicho bora kwa Kenya.

Je, mgawanyiko upo Kenya Kwanza?

Maoni yake yanakuja siku chache baada ya gavana wa Nyeri Mutahi Kahiga kuonya dhidi ya mipango yoyote ya kuhujumu Gachuaga katika serikali ya Kenya Kwanza.

Akizungumza mjini Nyeri mnamo Jumapili, Mei 19, Kahiga alidokeza uwezekano wa kutofautiana kati ya Rais William Ruto na Gachagua.

Kahiga mwenye msimamo mkali alisema watu wa eneo la Mlima Kenya hawatakubali Gachagua kudhulumiwa kama vile Ruto alivyodaiwa kudhulumiwa chini ya utawala wa rais wa zamani Uhuru Kenyatta.

Aliongeza kuwa Gachagua hakuteuliwa katika wadhifa wake wa sasa; badala yake, alichaguliwa kama kiongozi mwingine yeyote na anastahili heshima.

Read ENGLISH VERSION

Je, unayo taarifa ya kusisimua ambayo ungependa tuichapishe? Tafadhali, wasiliana nasi kupitia news@tuko.co.ke au WhatsApp: 0732482690.

MAKINIKA: Jinyakulie habari ZINAZOKUFAA ➡️ tafuta “IMEPENDEKEZWA KWA AJILI YAKO” na ufurahie!

Chanzo: TUKO.co.ke"
"Martha Karua Amjibu Kihuni Gachagua Anayetaka Kuwepo Mazungumzo Mlima Kenya: ""Mimi Siitwi Ovyo Ovyo""","Martha Karua alipuuzilia mbali wito wa mazungumzo na Naibu Rais Rigathi Gachagua, akisema kuwa hajapokea mwaliko rasmi

Katika hali ambayo haijawahi kushuhudiwa, Naibu Rais Gachagua amewataka Karua na katibu mkuu wa Jubilee Jeremiah Kioni kukutana na kujadili masuala yao

Gachagua alisisitiza hadhi yake kama kiongozi mkuu zaidi katika eneo hilo na kuwaalika Karua na Kioni kufanya mazungumzo naye

Karua alikosoa hali isiyo rasmi ya mwaliko huo, na kumtaka Gachagua kumwalika moja kwa moja kwa mijadala yoyote ya kina

Kiambu - Kiongozi wa Narc Kenya Martha Karua amepuuza wito wa mazungumzo na Naibu Rais Rigathi Gachagua.

Kiongozi wa Narc Kenya Martha Karua. Picha: Martha Karua

Chanzo: Twitter

Kiongozi wa Narc Kenya Martha Karua. Picha: Martha Karua

Chanzo: Twitter

Katika hali ambayo haijawahi kushuhudiwa, nai u rais alitoa wito kwa Karua na katibu mkuu wa Jubilee Jeremiah Kioni kukutana naye na kuwasilisha maswala yao.

Gachagua aliona kuwa yeye ndiye kiongozi mkuu zaidi katika eneo hili na kwamba wanasiasa hao wawili wanapaswa kufanya mazungumzo naye.

Matamshi ya naibu rais yalijiri huku kukiwa na mipango ya Limuru III, ambapo jumuiya hiyo inatarajiwa kuainisha mustakabali wao wa kisiasa.

“Waje tuzungumze, mimi ndiye kiongozi mkuu wa mkoa huu, milango yangu iko wazi, aje dada yangu Martha Karua, aje kaka yangu Jeremiah Kioni, unajua nina maana nzuri kwa mkoa huu na mimi ni bora. mtu wa kuzungumza naye wakati wowote siku yoyote,” alisema Gachagua.

Je, Karua alimjibu vipi Rigathi

Akihutubia wanahabari mjini Limuru kabla ya mkutano huo uliokuwa ukisubiriwa kwa hamu, Karua alisema kuwa hakuwa amepokea mwaliko.

Mwanasiasa huyo mkongwe aliongeza kuwa hachukui kile alichokitaja kama mialiko ya soko, akimsihi naibu rais kumwalika moja kwa moja.

""Nialike moja kwa moja sio sokoni haswa ikiwa ni mazungumzo ya mtu na mtu. Sijapokea mwaliko wowote na narudia sichukui mwaliko wa soko,"" Karua alisema.

Read ENGLISH VERSION

Je, unayo taarifa ya kusisimua ambayo ungependa tuichapishe? Tafadhali, wasiliana nasi kupitia news@tuko.co.ke au WhatsApp: 0732482690.

MAKINIKA: Jinyakulie habari ZINAZOKUFAA ➡️ tafuta “IMEPENDEKEZWA KWA AJILI YAKO” na ufurahie!

Chanzo: TUKO.co.ke"
"Washirika wa William Ruto Wadai Mkutano wa Limuru III Haukuwashtua kwa Njia Yoyote: ""Upuuzi tu""","Mnamo Ijumaa, Mei 17, aliyekuwa rais Uhuru Kenyatta aliidhinishwa kuwa kiongozi wa muungano mpya wa Haki wakati wa mkutano wa Limuru III.

Hata hivyo washirika wa Rais Willia Ruto wamejitokeza kukashifu mkutano huo wakiutaja kuwa wa kikabila na mgawanyiko.

Wakiongozwa na kiongozi wa wengi katika Bunge la Kitaifa Kimani Ichung'wah, viongozi hao walimtaka Uhuru kukoma kueneza siasa za migawanyiko nchini

Nairobi - Washirika wa Rais William Ruto wameguswa na matukio ya hivi majuzi ya kisiasa kufuatia mkutano wa Limuru III.

Kiongozi wa Muungano wa Kenya Kwanza alimshutumu Uhuru Kenyatta kwa kuwa nyuma ya Limuru III. Picha: Kimani Ichung'wah/Uhuru Kenyatta.

Chanzo: UGC

Wakati wa harambee ya kutoa pesa Jumamosi, Mei 18, katika Shule ya Msingi ya Tombo huko Malava, viongozi wa Muungano wa Kenya Kwanza walimwaga risasi rais wa zamani Uhuru Kenyatta.

Kwa nini washirika wa William Ruto hawana furaha na Uhuru Kenyatta?

Viongozi hao walimshutumu Uhuru kwa kusukuma ajenda ya mgawanyiko na ukabila baada ya mkutano wa Limuru III kumuidhinisha kuwa kiongozi wa Muungano wa HAKI.

""Uhuru anatakiwa kumuiga marehemu Mwai Kibaki. Alipochukua wadhifa wa urais kutoka kwa Daniel Moi, watu walidhani angemkasirisha mtangulizi wake. Lakini hili halikufanyika. Alipostaafu baada ya kutumikia muhula wake, alijiweka chini na hakurejea tena. kuingilia jinsi Kenyatta alivyokuwa akiendesha nchi,"" Mbunge wa Laikipia Mashariki Mwangi Kiunjuri alisema kama ilivyoripotiwa na Citizen Digital.

Kiongozi wa walio wengi katika Bunge la Kitaifa Kimani Ichung'wah aliutaja mkutano wa Limuru III kuwa jukwaa la walioshindwa kisiasa kutafuta umuhimu.

“Siasa za ukanda, ukabila na kurudi nyuma zimepitishwa na wakati; siasa za kuabudu utu na siasa za utu ziko nyuma yetu. Tukiangalia mbele, sisi viongozi katika nchi hii, tunataka siasa zinazoegemea kwenye itikadi; siasa ambazo zitawaunganisha watu wa Kenya kuwa kitu kimoja katika kutafuta ustawi kwa manufaa ya Wakenya wengi,” Ichung’wah alisema.

Kwa upande wake, Seneta Aaron Cheruyot alisema mkutano huo ulikuwa wa kikabila na hauna ajenda ya Wakenya.

“Hawa ni watu wanaotetea chuki, na uvivu na hawana ajenda kwa Kenya. Ninaamini katika Mradi wa Kenya; taifa lisilogawanyika ambapo sote tunaweza kufanikiwa pamoja,"" Cheruyot alisema.

Msaidizi wa Ruto, Farouk Kibet, pia alipuuzilia mbali waandalizi wa mkutano huo uliogubikwa na kelele nyingi, akisema ulinuiwa tu kugawanya nchi.

Kwa nini Uhuru aliteuliwa kuwa mkuu wa muungano wa HAKI

Kama ilivyoripotiwa hapo awali, baadhi ya viongozi kutoka eneo la Mlima Kenya walizindua muundo mpya wa kisiasa, muungano wa HAKI.

Kuundwa kwa muungano huo kuliashiria kilele cha kongamano lililotangazwa sana la Limuru 3, ambalo lilifanyika Ijumaa, Mei 18, Limuru, kaunti ya Kiambu.

Kiongozi wa chama cha NARC Kenya Martha Karua, Katibu Mkuu wa Jubilee Jeremiah Kioni na aliyekuwa gavana wa Laikipia Nderitu Muriithi waliongoza wanasiasa wengine na wakaazi kutoka Mlima Kenya kutetea masilahi ya eneo hilo wakati wa kongamano hilo.

Viongozi katika kongamano hilo walikubaliana kwa kauli moja kwamba Muungano wa Haki utaongozwa na aliyekuwa rais Uhuru Kenyatta, ambaye atakuwa akitetea maslahi ya watu wa kati.

Read ENGLISH VERSION

Je, unayo taarifa ya kusisimua ambayo ungependa tuichapishe? Tafadhali, wasiliana nasi kupitia news@tuko.co.ke au WhatsApp: 0732482690.

MAKINIKA: Jinyakulie habari ZINAZOKUFAA ➡️ tafuta “IMEPENDEKEZWA KWA AJILI YAKO” na ufurahie!

Chanzo: TUKO.co.ke"
"William Ruto Apigwa na Butwaa Kukutana na Nguli wa NBA Shaquille O'Neal Marekani","Ziara ya rais William Ruto nchini Marekani ni ziara ya kwanza ya rais wa Kenya nchini Marekani katika kipindi cha miaka ishirini

Ruto na mkewe, Mama wa Rais Mama Rachel Ruto, walikutana na nguli wa NBA Shaquille O'Neal, na Wakenya hawakusita kubaini jinsi nyota huyo alibvo na kimo cha urefu

Rais katika video hiyo akiwa na furaha alimpa salamu mwanariadha huyo na kuweka mkono wake kwenye bega lake O'neal

Rais William Ruto amekutana na nguli wa NBA Shaquille O'Neal akiwa katika ziara yake nchini Marekani.

William Ruto na mkewe, Rachel Ruto, wakutana nyota wa NBA Shaquille O'Neal mbele ya Bernice King. Picha: Citizen TV.

Chanzo: Twitter

Je, maoni ya Ruto yalikuwa yapi baada ya kukutana na Shaquille O'Neal?

Rais anaishi ndoto za wapenzi wengi wa mpira wa vikapu baada ya kukutana na gwiji Shaquille O'Neal.

Kwa wapenzi wasio wa mpira wa vikapu, O'Neal ni bingwa mstaafu wa NBA ambaye urefu wake ni mita 2.16.

Mwanariadha huyo alionekana kama jitu karibu na Rais William Ruto.

Ruto na mkewe, Mama Rachel Ruto, walikuwa pamoja na Balozi wa Marekani nchini Kenya Meg Whitman.

Rais alikuwa akitembelea Mbuga ya Kitaifa ya Historia ya Martin Luther King Jnr huko Atlanta.

Alimpa salamu O'Neal kwa furaha. Aliweka mkono wake kwenye bega la mwanariadha huyo, akionekana kuduwazwa na kimo chake.

Rais aliendelea kumtazama bingwa huyo wa zamani wa NBA katika video ambayo imesambaa kwa kasi.

Maoni ya wanatamtandao Ruto akikutana na Shaquille O'Neal

@ougooduor

""Tungependa kusikia kuhusu ufadhili wa masomo ya mpira wa vikapu sasa.""

@PeterKamondeN

""@SHAQ ni jitu mpole, linalowafunika Rais @WilliamsRuto na @MamaRachelRuto.""

@adan_zamuh

""Rachel amepotelea ndani ya mkono wa shaq.""

@wanyama__wafula

""Huyo jamaa ni jitu.""

@ProfOnyi

""Jamani, huyu mtu ni mrefu bruvvvvv.""

@langaTweets

""Shaq O'Neil ni jitu Ruto amebaki kushangaa sana.""

@bungomaduke:

""Rais amedawaa sana.""

Read ENGLISH VERSION

Je, unayo taarifa ya kusisimua ambayo ungependa tuichapishe? Tafadhali, wasiliana nasi kupitia news@tuko.co.ke au WhatsApp: 0732482690.

MAKINIKA: Jinyakulie habari ZINAZOKUFAA ➡️ tafuta “IMEPENDEKEZWA KWA AJILI YAKO” na ufurahie!

Chanzo: TUKO.co.ke"
"Pasta Kanyari Akanusha Penyenye Alipakua Asali ya Rish Kamunge: ""Mimi Niko Single""","Mchungaji Kanyari alikana kumpachika TikToker Rish Kamunge mimba, na kupuilia mbali uvumi alilala kwa kisura huyo

TikToker huyo alidai kwamba alikuwa amebeba ujauzito wa Kanyari na kwamba alimnunulia gari wakati wa TikTok live

Mwanzilishi wa Salvation Healing Ministry alikanusha kuwa katika uhusiano na TikToker yoyote, akisema yeye bado ni mseja

Kasisi Kanyari amejitokeza wazi kuhusu madai ya kumpa ujauzito TikToker Rish Kamunge.

Mchungaji Kanyari akiwa na Rish Kamunge na Faith Peters, wakipiga picha wakati wakihudhuria ibada kanisani mwa mhubiri huyo. Picha: Faith M Peters

Chanzo: Instagram

Rish Kamunge ni nani?

Hivi majuzi TikToker huyo alitanba kwa kasi baada ya kuahidi kuangazia yeye na Kanyari, ambaye alimtaja kama mpenzi wake.

Mwanamke huyo alitaniana na Kanyari, akieleza jinsi alitaka watangamane na kile alichotaka wafanye kama wanandoa.

MAKINIKA: Watumie wahariri wetu taarifa yako unayoiona kuwa bora! Tafadhali wasiliana nasi kupitia news@tuko.co.ke au WhatsApp: 0732482690.

Katika video kadhaa za mtandaoni, mhubiri huyo alionekana akizungumza na mwanamke huyo, akishangazwa na pendekezo lake la kiajabu.

Kanyari akanusha madai ya kuchumbiana na TikTokers

Mnamo Jumanne, Mei 21, Rish alidai alikuwa na ujauzito wa Kanyari.

Alimshutumu mpinzani wake, Faith Peters, ambaye pia anadai kuwa mpenzi wa Kanyari, kwa kulazimisha uhusiano wao.

""Kanyari ameninunulia gari. Wewe amekupea nini? Hata namba yake binafsi huna wewe!""

Pia alidai kuwa Kanyari amelala nyumbani kwake.

""Amelala kwangu,"" alisema.

Mtumishi wa Mungu alikanusha madai hayo wakati akizungumza na mashabiki zake 12.8k.

""Ni uwongo nakuambia ukweli. Nilimjua juzijuzi tu. Nilimwona kwa mara ya kwanza Jumapili alipohudhuria ibada yangu ya kanisa,"" alisema.

Kanyari pia alikanusha madai kuwashirikisha wanawake waliodai kuwa wapenzi wake.

""Hakuna msichana nimetongoza. Hakuna msichana nimesema nataka. Ruish ananimeea tu mate. Niko singo.""

Kanyari azungumza baada ya zawadi ya kondomu

Wakati mahojiano ya moja kwa moja, mtumishi wa Mungu alisafisha hewa baada ya wengi kumsuta kwa kutoheshimu nyumba ya Bwana kwa kuburudisha TikTokers.

Pasta huyo mwenye utata alisema TikTokers walikuwa wanamwaibisha.

Vigogo wa TikTok Big Daddy, Kioi na Mali Safi walimkashifu Kanyari kwa kuwaburudisha wanawake kwenye TikTok, wakimshauri ajiepushe nao kabla ya kuharibu huduma yake.

Read ENGLISH VERSION

Je, unayo taarifa ya kusisimua ambayo ungependa tuichapishe? Tafadhali, wasiliana nasi kupitia news@tuko.co.ke au WhatsApp: 0732482690.

MAKINIKA: Jinyakulie habari ZINAZOKUFAA ➡️ tafuta “IMEPENDEKEZWA KWA AJILI YAKO” na ufurahie!

Chanzo: TUKO.co.ke"
"Rapa wa Miaka 17 Ajifyatulia Risasi Kimakosa na Kufariki Akirekodi Video","Mnamo Jumatano, Mei 15, mwanamuziki na TikToker Rylo Huncho alijipiga risasi na kujiua katika hali ya kutatanisha

Kulingana na polisi, rapper huyo mchanga alifriki dunia kutokana na ""jeraha la kujipiga risasi kwa bahati mbaya"" kichwani

Katika picha hiyo ya mtandaoni, TikToker alinaswa akiimba kwenye kamera huku akicheza na bastola yenye leza ya kijani kibichi iliyoelekezwa kwenye kichwa chake muda mfupi kabla ya kujifyatua

Huzuni iliikumba familia moja baada ya TikToker mwenye umri wa miaka 17, aliyetambulika kama Rylo Huncho, kufariki dunia katika ajali mbaya ya bunduki huko Virginia.

Rapa mwenye umri wa miaka 17, Rylo Huncho alikuwa akirekodi video wakati ajali hiyo ilipotokea. Picha: Rylo Huncho.

Chanzo: UGC

Polisi wanasema rapper huyo mwenye umri wa miaka 17 alijipiga risasi kwa bahati mbaya Jumatano, Mei 15, akiwa nyumbani kwake.

Taarifa ya New York Post ilisema ajali hiyo ilitokea wakati bunduki aliyokuwa akitumia kwa video hiyo ilipofyatuka bila yeye kutarajia, na kusababisha kifo chake cha ghafla.

Polisi walisema nini kuhusu sababu ya kifo cha Rylo Huncho

Katika video iliyoonekana na TUKO.co.ke, rapa huyo mchanga ananaswa akiimba kwenye kamera huku akicheza na bastola yenye mwonekano wa kijani kibichi iliyoelekezwa kwenye kichwa chake muda mfupi kabla ya kufyatua risasi.

Kulingana na polisi, rapper huyo mchanga alipoteza maisha yake kutokana na ""jeraha la kujipiga kwa risasi"" kichwani.

Kufuatia msiba huu, kumekuwa na hughuli ya kutafuta msaada kuisaidia familia yake.

Binamu yake alithibitisha kisa hicho katika chapisho, akisema alikuwa mtoto wa pekee kwa mzazi mmoja.

“Alikuwa mwana wa pekee. Alilelewa na mzazi asiye na mwenzi lakini alimtunza mwanawe kadri alivyoweza. Bado tunajaribu kujua kiini cha kisa hicho. Lakini chochote, ninamaanisha chochote, kinaweza kumsaidia wakati huu wa hitaji.” binamu wa rapper huyo aliandika.

Jinsi TikToker Mkenya alivyofariki kwa njia isiyoeleweka

Kwingineko, mwanamke aliyejulikana kwenye TikTok kama Lynette alifariki dunia wiki moja baada ya kudaiwa kumpeleka nyumbani mpenzi wake Mmarekani mweusi kwa ajili ya kujitambulisha.

Ingawa familia yake haijatoa habari, marafiki zake wa karibu kwenye TikTok walisimulia kwamba alikufa muda mfupi baada ya kurejea jijini.

Kulingana na marafiki wa karibu, Lynette alikuwa akipenda kushiriki picha na video zake mwenyewe na mpenzi wake, akionyesha shughuli zao na nyakati nzuri.

Read ENGLISH VERSION

Je, unayo taarifa ya kusisimua ambayo ungependa tuichapishe? Tafadhali, wasiliana nasi kupitia news@tuko.co.ke au WhatsApp: 0732482690.

MAKINIKA: Jinyakulie habari ZINAZOKUFAA ➡️ tafuta “IMEPENDEKEZWA KWA AJILI YAKO” na ufurahie!

Chanzo: TUKO.co.ke"
"Oyugis Finest: Stivo Simpo Boy Awavunja Wakenya Mbavu na Luku ya Ajabu","Stivo Simple Boy alivalia jinzi ya denim iliyochakaa na mabaka ya sufu na sweta ya pamba inayolingana, na hivyo kuunda mwonekano wa kipekee

Video ya mavazi ya Stivo, aliyoshirikishwa na Remcy Don, ilisambaa haraka na kuvutia watu wengi

Wanamtandao walikuwa na hisia mseto, wengine wakiyaona mavazi hayo ya kuchekesha na baadhi wakionyesha wasiwasi kwamba Stivo alikuwa akidhihakiwa

Msanii Stivo Simple Boy amezua gumzo kwenye mitandao ya kijamii kwa kauli yake ya hivi punde ya mitindo wa kiajabu.

Chaguo la kipekee la mtindo wa Stivo Simple Boy ambalo limewasisimua sana Wakeny. Picha: Remcy Don.

Chanzo: Instagram

Katika video iliyosambazwa na Remcy Don, Stivo anaonekana akiwa amevalia suruali ya jeans ya denim iliyoambatanishwa na kilele chenye rangi nyeusi cha turtleneck.

Walakini, sababu ya hali yake inayovuma inakwenda zaidi ya hii.

Je, Stivo Simpe Boy alivalia nini?

Suruli yake ya Jeans ilikuwa na mwonekano wa kipekee, ikiwa na mabaka ya sufu kwenye magoti.

Mwimbaji huyo wa Freshi Barida alivalia sweta yenye rangi sawa na zilizounganishwa kwenye vipande vya goti vya jeans yake.

Suruali na sweta zilijitokeza kama ubunifu wa kipekee, na hivyo kumfanya Remcy kuzifananisha na blanketi la Raymond.

Video hiyo imepepea sana tangu wakati huo, ikiibua kicheko na maoni mengi kutoka kwa wanamtandao.

fesman14:

""Anaonekana mpole ... ningesema ametumiwa vibaya katika hali hii. Walimvalisha hivyo na kuchukua video ili kumcheka, na maskini anafikiri kuwa anapata umaarufu zaidi.""

taitanic_safaris:

""Miundo nzuri lakini haimfai.""

sammie_snn:

""Anakaa mganga.""

jony_muasa:

""Nini hizi mnavalisha Stevo.""

_.imhe:

""Maskini mnamtumia Stivo vibaya.""

Ritchie:

""Oyugis finest.""

Stivo Simple Boy awachekesha Wakenya akizungumza Kiingereza

Hapo awali, msanii uyo alisisimua mashabiki baada ya kujaribu kuzungumza Kiingereza wakati wa mahojiano.

Stivo alikuwa kwenye mahojiano yaliyoshirikiwa kwenye TikTok na @Kingbzzyszn, akijibu maswali ya moja kwa moja.

Mhojiwa alisema:

""Stivo Simple Boy, jikadirie kwa kipimo cha moja hadi 10.""

Alijibu:

""Kwenye nini?""

Kisha mwenyeji akarudia sentensi yake, ambayo ilimwacha mwimbaji huyo mwenye talanta akipasua kicheko kabla ya kujibu.

Kisha Stivo akasema:

""Mimi niko ngazi ya kwanza. Sio 10.""

Kisha wote wawili wakacheka huku mwenyeji akiuliza swali lingine ili kupima hisia zake kwa kuwa na mpenzi mwenye pesa kumliko.

""Ninajisikia vibaya 'bourrit'. Naskia vibaya sana,"" alisema.

Read ENGLISH VERSION

Je, unayo taarifa ya kusisimua ambayo ungependa tuichapishe? Tafadhali, wasiliana nasi kupitia news@tuko.co.ke au WhatsApp: 0732482690.

MAKINIKA: Jinyakulie habari ZINAZOKUFAA ➡️ tafuta “IMEPENDEKEZWA KWA AJILI YAKO” na ufurahie!

Chanzo: TUKO.co.ke"
"Pasta Kanyari Azawadiwa Kondomu na TikToker wa Kike Katika Ibada ya Jumapili: ""Tumia Kinga""","TikTokers walifurika katika kanisa la Mchungaji Kanyari Jumapili, Mei 19, ili kumpiga sapoti 'rais' wa TikTok

TikToker Faith Peters alimzawadia mhubiri huyo mwenye utata zawadi tatu, miongoni mwao ikiwa ni pakiti ya kondomu, kabla ya kukiri anammezea mate

Vitendo vya Faith vilizua hisia tofauti kwa watu, huku baadhi wakimsuta kwa kutoheshimu kanisa

TikToker wa kike aliyetambulika kwa jina la Faith M Peters amemwacha Mchungaji Kanyari akiwa na haya baada ya kumpa pakiti ya kondomu.

Mchungaji Kanyari (kushoto) aliachwa akiona haya baada ya TikToker Faith Peters (kulia) baada ya kumpa zawadi ya kondomu. Picha: Nabii Kanyari, Faith Peters.

Chanzo: UGC

Mfanyabiashara huyo alimpa Kanyari kifurushi kidogo kilichokuwa kimefungwa ndani ya gazeti.

Alipofungua, Kanyari, ambaye alikuwa amesimama kwenye mimbari, alionyesha kutaniko vitu vitatu: pedi za Kotex, mafuta ya arimis petroleum jelly na pakiti ya kondomu.

Faith kisha akadai kuwa aliota kuwa yeye na Kanyari walikuwa na harusi kubwa.

Mwanamke huyo alibaini kwamba alifahamu kuwa wanawake wengi walikuwa wakimmeze mate Kanyari, na akamshauri kuhakikisha anajikinga kila anapoingiliana kimapenzi nao.

""Naona wanawake wanamtaka sana Pastor Kanyari, nimemletea kinga ya maisha. Tumia kinga baba, usikatae wanawake dada huyo,"" alisema.

Faith alidai kumpenda mhubiri huyo mwenye utata, akimsihi amuoe.

""Nataka utoke pale kwa Rish Kamunge kuja hapa. Wacha kujiumiza bure hii tunaweka kando. Mimi nina uwezo wa kujifungua. Hebu tuongeze watoto zaidi kwa wale ambao wanaishi Marekani. Nimechoka,"" kidosho alisema.

Kanyari, ambaye hivi majuzi alifichua kwamba hakuwa na mchumba, alisimama kando ya Faith huku akiwa ameshikilia zawadi hizo huku akiona haya.

Hii hapa video:

Hisia za watu mtandaoni:

Danielson wa Monique alisema:

“Eiish mnaeenda spidi sana.Hamuogopi hata mtumishi wa Mungu.

Mercy Mutuli alisema:

""Jamani Mungu, utuhurumie.""

Ngetich Langat Jeff alisema:

""Hiyo ilikuwa zawadi bora zaidi kuwahi kupeanwa.""

Festus Murithi Poul alisema:

""Kondomu kanisa jamani?? Mchungaji yawa.""

Read ENGLISH VERSION

Je, unayo taarifa ya kusisimua ambayo ungependa tuichapishe? Tafadhali, wasiliana nasi kupitia news@tuko.co.ke au WhatsApp: 0732482690.

MAKINIKA: Jinyakulie habari ZINAZOKUFAA ➡️ tafuta “IMEPENDEKEZWA KWA AJILI YAKO” na ufurahie!

Chanzo: TUKO.co.ke"
"Eddie Butita Aandamana na William Ruto Marekani kwa Ziara ya Kiserikali: ""Tuna Furaha""","Eddie Butita amechaguliwa kuandamana na William Ruto katika ziara ya kiserikali nchini Marekani, ambayo itakuwa mwenyeji wa Joe Biden

Ziara ya serikali, inayoanza Mei 23, inalenga kusherehekea uhusiano wa muda mrefu kati ya Kenya na Amerika

Akitoa shukrani, Butita alisisitiza umuhimu wa ushiriki wake kama ishara kwamba tasnia ya ubunifu sasa ni sehemu ya mazungumzo muhimu ya kitaifa na kimataifa

Mchekeshaji Eddie Butita anaandamana na Rais William Ruto hadi Marekani.

Eddie Butita (i) anasherehekea kujumuishwa katika ujumbe wa Rais William Ruto wa Marekani. Picha: William Ruto/ Eddie Butita.

Chanzo: Instagram

Rais wa Marekani Joe Biden atakuwa mwenyeji wa Ruto. Ziara ya serikali itaanza Alhamisi, Mei 23.

Ziara ya William Ruto nchini Marekani

Biden alisema mkutano huo utaadhimisha uhusiano wa muda mrefu kati ya Kenya na Marekani.

Eddie Butita alifurahi sana

Kupitia Facebook, Butita alionyesha shukrani kubwa kwa fursa hiyo.

Mtayarishaji wa maudhui alisema kuwa kushiriki katika ujumbe huo ni ishara ya kweli kwamba tasnia ya ubunifu imejumuishwa kwenye mazungumzo.

""Ninaondoka kuelekea Marekani leo. Asante, Mheshimiwa Rais William Samoei Ruto, kwa kunichagua niandamane nawe katika Ziara ya Kiserikali ya Marekani iliyoandaliwa na Rais wa Marekani, Mheshimiwa Rais Joe Biden. Ukweli kwamba mimi"" m sehemu ya mkuu wa ujumbe wa serikali ni ishara wazi, na tunafurahi kuwa tasnia ya ubunifu ni sehemu ya mazungumzo ambayo tutakuwa nayo wakati wa safari hii, ""aliandika.

Ruto kukutana na nyota wa Hollywood

Kama tulivyokuambia hapo awali, Ruto atakutana na nyota wakuu wa Hollywood wakati wa ziara hiyo.

Katibu Mkuu wa Masuala ya Kigeni Dkt Korir Sing'oei alifichua kuwa ziara ya mkuu wa nchi nchini Marekani ilikuwa ni ziara ya kwanza ya kiserikali nchini Marekani kwa rais wa Afrika tangu 2018.

Akizungumza wakati wa mahojiano na Jeff Koinange wa runinga ya Citizen, Sing'oei alifichua kuwa kukutana na nyota wa Hollywood ilikuwa sehemu ya ratiba ya rais.

Alisema Ruto anafahamu viwango vya ubunifu vya Kenya na amejitolea kutoa msaada anaoweza kukuza sekta ya filamu na burudani.

Waziri Mkuu alithibitisha kwamba Ruto angetembelea Studio ya Tyler Perry huko Georgia, Atlanta, na kukutana na mmiliki, Tyler Perry.

Read ENGLISH VERSION

Je, unayo taarifa ya kusisimua ambayo ungependa tuichapishe? Tafadhali, wasiliana nasi kupitia news@tuko.co.ke au WhatsApp: 0732482690.

MAKINIKA: Jinyakulie habari ZINAZOKUFAA ➡️ tafuta “IMEPENDEKEZWA KWA AJILI YAKO” na ufurahie!

Chanzo: TUKO.co.ke"
