"Title","Content"
"Orodha ya Nchi za Afrika Zinazodaiwa Deni la Pesa Nyingi Walizokopa Kutoka China","Uchina ni mojawapo ya wakopeshaji wakubwa kwa nchi za Afrika, ikichangia asilimia 12 (KSh 94 trilioni) ya deni la nje la bara hilo

Kutokana na kiwango cha ukopeshaji wa China, Benki ya Dunia ilibainisha kuwa mataifa saba ya Kiafrika yamo katika dhiki ya madeni au hatari ya kukumbwa na deni

Mchambuzi wa soko wa FX Pesa, Rufas Kamau alieleza kuwa wakati Mfuko wa Fedha wa Marekani unapopandisha viwango vya riba, wajibu huongezeka kwa sababu nchi hutumia sarafu dhaifu za ndani kupata dola yenye nguvu

Ingawa China ni mojawapo ya wadai wakubwa wa nchi nyingi za Afrika, mikopo yake imepungua hivi karibuni.

Rais wa China Xi Jinping (wa pili kulia) akiwa na Rais William Ruto alipotembelea nchi hiyo ya Asia. Picha: Sam Terriz.

Chanzo: Facebook

Mlipuko wa COVID-19 na uvamizi wa Urusi nchini Ukraine ulikuwa na athari mbaya za kiuchumi, na kufanya iwe vigumu kwa nchi nyingi za Afrika kulipa deni lao la kitaifa.

Kulingana na Chatham House ya Uingereza, zaidi ya mataifa 20 ya kipato cha chini ya Afrika yalikuwa katika hatari kubwa ya kukiuka sheria.

Bloomberg ilifichua kuwa Uchina inachangia asilimia 12 ya deni la nje la Afrika la $696 bilioni (KSh 94 trilioni).

Kutokana na kiwango cha ukopeshaji wa China, Benki ya Dunia ilibainisha kuwa mataifa saba ya Kiafrika yamo katika dhiki ya madeni au katika hatari ya kukumbwa na deni.

Nchi hizi ni pamoja na Kenya, Angola, Djibouti, na Zambia.

Kwa nini nchi za Afrika ziko hatarini kukiuka sheria?

Mchambuzi mkuu wa soko la FX Pesa Rufas Kamau alibainisha kuwa nchi nyingi za Afrika, ikiwa ni pamoja na Kenya, zilikuwa na mikopo ya dola za Marekani (Marekani).

Alifafanua kuwa majukumu yanaongezeka wakati Hifadhi ya Shirikisho ya Marekani inapoinua viwango vya riba kwa sababu nchi hutumia sarafu zao dhaifu za ndani kupata dola yenye nguvu.

""Kenya, kama mataifa mengine mengi ya kiuchumi kusini mwa dunia, ina madeni kwa dola za Marekani. Wakati Hifadhi ya Shirikisho inapopandisha viwango vya riba, majukumu ya Kenya yanakuwa makubwa kwa sababu lazima itumie shilingi zaidi kupata dola inayothaminiwa na kisha kuitumia kulipa mikopo. hatari ya nchi hizi kukosa hati fungani huongezeka, na hivyo kusababisha mtiririko wa pesa kutoka mipakani na nchi zinazokua kiuchumi na kuelekea zile zilizoendelea,"" Kamau aliambia TUKO.co.ke.

Alieleza kuwa serikali ya Kenya inafuata makubaliano ya nchi mbili na washirika wake wakuu wa kibiashara ili kupunguza matatizo katika akiba ya fedha za kigeni.

""Ni kwa manufaa ya serikali ya Kenya kuingia mikataba ya nchi mbili na washirika wakuu wa biashara ili kupunguza shinikizo kwa akiba ya fedha za kigeni,"" Kamau aliambia TUKO.co.ke.

Nchi za Kiafrika zenye deni kubwa zaidi la China

1. Angola

Katika kipindi cha miaka 20 iliyopita, deni la China kwa Angola liliongezeka kwa kiasi kikubwa.

Serikali ya Angola ilitanguliza ujenzi mpya baada ya vita vya wenyewe kwa wenyewe kumalizika mnamo 2002.

China ilitoa mchango mkubwa kwa kuanzisha miradi zaidi ya 100, mingi ikifadhiliwa na mikopo ya mafuta katika nishati, maji, afya, elimu, mawasiliano ya simu, uvuvi na kazi za umma.

Kulingana na Business Insider, deni la Angola kwa Uchina lilifikia $42,619 milioni (KSh 5.7 trilioni) kufikia 2023.

2. Ethiopia

Kufikia mwisho wa Machi 2023, Ethiopia ilidaiwa $28.2 bilioni (KSh 3.8 trilioni) katika deni la nje.

Takriban nusu ya deni lote la nchi, $13.7 bilioni (KSh 1.84 trilioni), inadaiwa na Uchina.

3. Zambia

Takriban thuluthi moja ya deni la nje la serikali ya Zambia inadaiwa na China, mkopeshaji mkuu wa nchi hiyo.

Zambia inadaiwa Uchina wastani wa KSh 1.33 trilioni.

4. Kenya

Wakenya wanaendelea kuhisi kigugumizi katika ulipaji wa mikopo ya China iliyofadhili miradi mikubwa ya miundomsingi, ikiwa ni pamoja na Reli ya Standard Gauge (SGR).

Data kutoka kwa Hazina ya Kitaifa ilionyesha kuwa ulipaji wa deni uliongezeka kwa takriban nusu hadi KSh 107.42 bilioni katika mwaka wa kifedha wa 2022/23.

Deni la Kenya kwa Uchina ni zaidi ya KSh 1.2 trilioni.

Utawala wa Rais William Ruto unapanga kuwasilisha Bondi ya Panda ya $500 milioni (KSh 67.5 bilioni) kutoka taifa la Asia ili kufidia nakisi ya bajeti ya 2024/2025.

6. Cameroon

Cameroon ni nchi nyingine ya Kiafrika inayokopa fedha kutoka China ili kufadhili bajeti yake.

Deni la taifa hilo la Afrika Magharibi kwa Uchina ni KSh 837 bilioni.

6. Sudan

Katika miaka ya 2000, China iliipatia Sudan mabilioni ya mikopo na uwekezaji ili kusaidia uzalishaji wa mafuta na ukuaji wa uchumi.

Madeni ya Sudan kwa Uchina yalifikia dola bilioni 5.12 (KSh 832.8 bilioni) mnamo Machi 2023.

7. Jamhuri ya Kidemokrasia ya Kongo (DRC)

Kati ya 2000 na 2018, South China Morning Post iliripoti DRC ilikopa dola bilioni 2.4 katika mikopo 53 kutoka China kwa ajili ya miradi ya madini, usafiri na umeme.

Jumla ya mkopo unaodaiwa na China kwa sasa ni zaidi ya KSh 727.7 bilioni.

8. Nigeria

Legit News iliripoti kwamba Ofisi ya Kusimamia Madeni ya Nigeria (DMO) ilifichua kuwa katika nusu ya pili ya 2023, ahadi za madeni ya nchi hiyo kwa Uchina zilipanda kwa karibu dola milioni 500 hadi $5.16 bilioni (KSh 696.6 bilioni).

Uchina ndio mkopeshaji mkuu wa nchi mbili za Nigeria kwa kiasi kikubwa, ingawa asilimia yake ya jumla ya deni la umma la dola bilioni 68 bado ni ndogo sana, chini ya 7%.

Read ENGLISH VERSION

Je, unayo taarifa ya kusisimua ambayo ungependa tuichapishe? Tafadhali, wasiliana nasi kupitia news@tuko.co.ke au WhatsApp: 0732482690.

MAKINIKA: Jinyakulie habari ZINAZOKUFAA ➡️ tafuta “IMEPENDEKEZWA KWA AJILI YAKO” na ufurahie!

Chanzo: TUKO.co.ke"
"Ebrahim Raisi: Video Inayoonyesha Dakika za Mwisho za Rais wa Iran Kwenye Chopa Yaibuka","Rais wa Iran Ebrahim Raisi amefariki dunia baada ya helikopta yake kuanguka karibu na Jolfa Mashariki mwa Azerbaijan

Ndani ya ndege hiyo kulikuwa na maafisa wengine wa serikali, akiwemo Waziri wa Mambo ya Nje Hossein Amirabdollahian na Ayatollah Mohammad Ali Ale-Hashem

Abiria hawakuweza kuokolewa mara baada ya ajali hiyo kwa sababu ya hali ya hewa ya ukungu, na kufanya misheni kuwa na changamoto

Iran - Rais Ebrahim Raisi amefariki dunia baada ya chopa yake kuanguka karibu na Jolfa katika jimbo la Azerbaijan Mashariki siku ya Jumapili, Mei 19.

Ebrahim Raisi (pichani) alifariki dunia pamoja na viongozi wanane wa serikali katika ajali ya chopa wakitokea Azerbaijan. Picha: Ebrahim Raisi.

Chanzo: Twitter

Miongoni mwa abiria hao ni maafisa wengine wanane wa ngazi za juu, akiwemo Waziri wa Mambo ya Nje Hossein Amirabdollahian na Ayatollah Mohammad Ali Ale-Hashem, mwakilishi wa kiongozi mkuu wa Iran katika jimbo hilo.

Licha ya ajali hiyo kutokea saa moja jioni, juhudi za kuipata helikopta iliyoanguka na abiria ilikumbwa na changamoto na kuongeza muda wa kazi ya uokoaji hadi alfajiri ya Jumatatu, Mei 20.

Raisi alikuwa akishiriki katika uzinduzi wa bwawa pamoja na Rais Ilham Aliyev wa Azerbaijan siku iliyotangulia, Mei 18.

Kilichotokea kwenye video ya mwisho ya Raisi

Video imeibuka ikimuonyesha Raisi akifanya mazungumzo na afisa mwingine mkuu ndani ya ndege hiyo kabla ya kupoteza maisha yake katika hali ya kusikitisha.

Katika picha hiyo, marehemu mkuu wa nchi anaonekana akiwa na umakini, akichungulia nje ya dirisha kwenye eneo lenye milima huku afisa mwingine akionekana kutoa maelezo.

Hali ya hewa ya ukungu ilizidisha changamoto katika kumpata rais aliyefariki na maafisa wengine wanane ndani ya ndege hiyo, na hivyo kuchangia kucheleweshwa kwa juhudi za uokoaji.

Jenerali Francis Ogolla afariki katika ajali ya chopa

Wakati uo huo nchini Kenya, chopa ya Jeshi la Ulinzi la Kenya ilianguka Aprili 2024 na kumuua aliyekuwa Mkuu wa Majeshi ya Ulinzi Jenerali Francis Ogolla.

Alikufa papo hapo, pamoja na askari wengine tisa wa ngazi za juu, na kuacha manusura wawili tu akiwemo mpiga picha.

Ndege hiyo iliteremka na kuwaka moto katika eneo la Kaben huko Elgeyo Marakwet maafisa hao 12 walipoelekea North Rift kukagua ukarabati unaoendelea wa shule.

Read ENGLISH VERSION

Je, unayo taarifa ya kusisimua ambayo ungependa tuichapishe? Tafadhali, wasiliana nasi kupitia news@tuko.co.ke au WhatsApp: 0732482690.

MAKINIKA: Jinyakulie habari ZINAZOKUFAA ➡️ tafuta “IMEPENDEKEZWA KWA AJILI YAKO” na ufurahie!

Chanzo: TUKO.co.ke"
"Raisi: Rais wa Iran, Abiria Wote Wathibitishwa Kufariki Kufuatia Ajali ya Helikopta","Mnamo Jumapili, Mei 19, helikopta iliyokuwa imembeba Rais wa Iran Ebrahim Raisi ilipata shida ya kutua karibu na Jolfa katika jimbo la Azerbaijan Mashariki mwa Iran

Kufuatia upekuzi huo, Jumuiya ya Hilali Nyekundu iligundua mabaki ya helikopta hiyo, lakini hakukuwa na dalili ya uhai

Picha kutoka eneo la tukio zinaonyesha kuwa helikopta iliyokuwa imembeba rais na Waziri wa Mambo ya Nje wa Iran, Hossein Amir-Abdollahian, iliharibika kabisa

Rais wa Iran Ebrahim Raisi amethibitishwa kufariki kufuatia ajali ya helikopta Jumapili, Mei 19.

Rais Ebrahim Raisi amethibitishwa kufariki. Picha: Sulaiman Ahmed.

Chanzo: Twitter

Baada ya saa kadhaa za kutafuta, timu ya uokoaji iliipata helikopta hiyo kwenye mteremko wa kilima katika mkoa wa Varzaghan eneo la Azerbaijan Mashariki.

Mwenyekiti wa Jumuiya ya Hilali Nyekundu ya Jamhuri ya Kiislamu ya Iran, Kolivand ametangaza kuwa, mabaki ya helikopta iliyokuwa imewabeba Rais Ebrahim Raisi, Waziri wa Mambo ya Nje Hossein Amir-Abdollahian na maafisa wengine kadhaa yamepatikana.

Mkuu wa Shirika la Hilali Nyekundu alisema hakuna dalili zozote za uhai, kwani helikopta hiyo ilikuwa imeteketea kabisa wakati wa ajali hiyo.

MAKINIKA: Watumie wahariri wetu taarifa yako unayoiona kuwa bora! Tafadhali wasiliana nasi kupitia news@tuko.co.ke au WhatsApp: 0732482690.

""Vikosi vya uokoaji vilifika kwenye mabaki ya helikopta hiyo. Baada ya kugundua eneo la helikopta iliyoanguka, hakuna dalili za watu waliokuwa ndani ya helikopta hiyo kuwa hai zilizoonekana,"" Kolivend alisema.

Picha zilizoshirikiwa zinaonyesha helikopta iliyombeba rais wa Iran na waziri wa mambo ya nje karibu kuharibiwa kabisa.

""Helikopta ya Rais Raisi iliteketea kabisa katika ajali hiyo ... kwa bahati mbaya, abiria wote wanahofiwa kufa,"" afisa mmoja wa Iran alisema akinukuliwa na Reuters.

Jinsi chopa ya Ebrahim Raisi ilivyoanguka

Kama ilivyoripotiwa hapo awali, helikopta iliyokuwa imembeba Raisi ilipata shida ya ""kutua"" karibu na Jolfa mkoa wa Azerbaijan Mashariki wa Iran.

Raisi alikuwa katika nchi jirani ya Azerbaijan kuzindua bwawa pamoja na Rais Ilham Aliyev siku ya Jumamosi, Mei 18.

Kulingana na Aljazeera, televisheni ya taifa ilisema watu waliokuwa na rais ndani ya helikopta hiyo walifanikiwa kupiga simu ya dharura.

Ilisemekana kuwa Waziri wa Mambo ya Nje Hossein Amirabdollahian na mwakilishi wa kiongozi mkuu wa Iran katika jimbo hilo, Ayatollah Mohammad Ali Ale-Hashem, walikuwa katika helikopta moja na Raisi.

Read ENGLISH VERSION

Je, unayo taarifa ya kusisimua ambayo ungependa tuichapishe? Tafadhali, wasiliana nasi kupitia news@tuko.co.ke au WhatsApp: 0732482690.

MAKINIKA: Jinyakulie habari ZINAZOKUFAA ➡️ tafuta “IMEPENDEKEZWA KWA AJILI YAKO” na ufurahie!

Chanzo: TUKO.co.ke"
"William Ruto Aruka Kuelekea Marekani kwa Ziara ya Kiserikali ya Siku 4","Rais William Ruto ataondoka kwa ziara ya kiserikali ya siku 4 nchini Marekani, kuanzia Jumatatu, Mei 20.

Marais Joe Biden, William Ruto, na Mke wa Rais Rachel wakiwa kwenye tafrija iliyoandaliwa na Biden wakati wa Kikao cha 77 cha Baraza Kuu la Umoja wa Mataifa, New York. Picha: William Ruto.

Chanzo: Facebook

Katika taarifa kwa vyombo vya habari, msemaji wa ikulu Hussein Mohammed alifichua kuwa ziara ya rais inalenga kutetea uwekezaji zaidi nchini Kenya, huku kukiwa na ratiba iliyojaa mbeleni.

Kulingana na Mohamed, ziara hiyo itaonyesha ushirikiano thabiti kati ya Kenya na Marekani, kuheshimu miaka 60 ya uhusiano wa kidemokrasia na kuimarisha ahadi za pamoja za ukuaji wa uchumi, amani na usalama.

""Ushirikiano wa kimkakati unaanzisha muundo wa mazungumzo ya kimkakati baina ya Kenya na Marekani yanayozingatia mada tano muhimu ambazo ni; ustawi wa kiuchumi kupitia biashara na uwekezaji, ushirikiano wa kiulinzi, demokrasia huria, utawala na usalama wa kiraia, masuala ya kimataifa na kikanda, na ushirikiano wa afya, ""aliongeza.

Ziara hiyo pia itaangazia umuhimu wa kimkakati wa Kenya kama nanga ya kanda na lango kuu la kibiashara kwa Afrika Mashariki.

Ruto atafanya nini Marekani?

Mnamo Jumatatu, Mei 20, Ruto ameratibiwa kusafiri hadi Atlanta, Georgia, ambapo atazuru Maktaba ya Rais ya Jimmy Carter na Jumba la kumbukumbu ili kusisitiza kujitolea kwa kila upande kwa uongozi na juhudi za kupambana na ufisadi.

Kufuatia haya, atatoa heshima kwa vuguvugu la kutetea haki za kiraia katika Kanisa la Ebenezer Baptist kabla ya kuelekea katika makao makuu ya Vituo vya Kudhibiti Magonjwa (CDC) kujadili ushirikiano wa afya kati ya Marekani na Kenya.

Raia wa Kenya walioko Atlanta watamkaribisha Ruto na mwenzi wake, Rachel Ruto, kuhitimisha shughuli za siku hiyo.

Mbali na mazungumzo haya, rais atazingatia ajenda zingine muhimu zinazolenga kuvutia uwekezaji.

Mohamed aliangazia kuwa Ruto atatoa hotuba katika Chuo cha Spelman huko Atlanta Jumanne, Mei 21, akizingatia jukumu muhimu la elimu ya juu katika kuendeleza sayansi na teknolojia.

Baadaye katika siku hiyo, atachunguza fursa ndani ya uchumi wa ubunifu katika Tyler Perry Studios na kisha kufuata njia mpya za uwekezaji katika Kampuni ya Coca-Cola.

Ruto pia atazindua duka la kwanza la Vivo na, akiandamana na mke wa rais, kuhudhuria chakula cha jioni kilichoandaliwa na meya wa Atlanta, Andre Dickens.

Ruto kutunukiwa heshima za kitaifa

Kulingana na mipango iliyoainishwa, Jumatano, Mei 22, Ruto ataondoka kuelekea Washington, DC, ambako atatunukiwa kwa sherehe kamili za heshima za serikali.

Baadaye, atakutana na wajumbe wa bunge na kushiriki katika majadiliano huko Capitol Hill.

Kilele cha ziara yake ya kitaifa kitakuwa mkutano wa nchi mbili na mwenzake Rais Joe Biden mnamo Alhamisi, Mei 23, unaolenga kuangazia fursa za maendeleo.

Read ENGLISH VERSION

Je, unayo taarifa ya kusisimua ambayo ungependa tuichapishe? Tafadhali, wasiliana nasi kupitia news@tuko.co.ke au WhatsApp: 0732482690.

MAKINIKA: Jinyakulie habari ZINAZOKUFAA ➡️ tafuta “IMEPENDEKEZWA KWA AJILI YAKO” na ufurahie!

Chanzo: TUKO.co.ke"
"Baiskeli ya Kwanza Duniani Iliyotengenezwa Zaidi ya Miaka 200 Iliyopita","Baiskeli ya kwanza duniani ilitengenezwa na Karl Drais raia wa Ujerumani mwaka wa 1817, askari wa msituni ambaye alikuwa na elimu ya Fizikia na Hesabu.

Mwaka huo, Drais aliiendesha kwa mara ya kwanza mashine hiyo aliyoipa jina 'Laufsmaschine'. Kulingana na wasifu ulioandikwa na Dkt. Gerd Hüttmann:

Karl Drais alikuwa askari wa msituni ambaye alikuwa na elimu ya Fizikia na Hesabu. Aliivumbua baiskeli ya kwanza. Picha: Pinterest

Chanzo: UGC

""Mnamo Juni 12, 1817 Karl Friedrich Christian Ludwig, Freiherr (= baron) Drais aliiendesha baiskeli aliyoivumbua ya magurudumu mawili, maili tano kutoka katikakati mwa Mannheim na kurejea katika muda chini ya saa moja.

Ilikuwa baiskeli bila ya vikanyagio lakini mtu alihitaji kutumia miguu yake kuisaidia kwenda, ilikuwa yenye kasi kuliko kutembea. Aliiita Laufmaschine (mashine iliyokimbia Ujerumani) lakini vyombo vya habari viliiita 'Draisine' kutokana na jina lake.""

Baiskeli ya kwanza duniani iliyovumbuliwa na Kirl Drais mwaka wa 1817. Picha: 200jahre-fahrrad.de

Chanzo: UGC

Kilichomsukuma kuvumbua baiskeli hiyo kimeelezwa kuwa kukabiliana na mgogro wa kimazingira uliokuwa umetokea wakati huo. Alitaka madala wa kutumia farasi ambao walikuwa wakitumiwa siku hizo.

Miaka miwili kabla ya uvumuzi wake, Mlima Tambora ulilipuka na kuubadilisha ulimwengu. Jivu la volkeno lilisababisha kutoonekana kwa jua 1816 na mwaka huo kupewa jina la ""mwaka bila jua"", na kulitokea njaa kubwa duniani.

Farasi wengi walichinjwa kwa sababu palikosekana chakula cha kuwalisha na wakaliwa na wafugaji wao kwa kuwa nao pia walikuwa hanawa chakula.

Baron Karl von Drais alitaka kukitumia kifaa chake bila ya kuwahusisha farasi na wanyama wengine ambao walikuwa wameangamizwa na njaa iliyokuwa imetokea. Picha: We love cycling

Chanzo: UGC

Baron Karl von Drais alitaka kukitumia kifaa chake bila ya kuwahusisha farasi na wanyama wengine ambao walikuwa wameangamizwa na njaa iliyokuwa imetokea. Drais aligundua kuwa, kwa kuweka magurudumu katika fremu za mbao alizokuwa ametengeneza, angefanikiwa kuipanda na kuidhibiti. Lloyd Alter aliandika kupitia jarida la Tree Hugger.

Kuweza kufika katika shamba lake na kufanya shughuli zake bila ya kuchoka, kuliifanya Laufsmaschine kuwa baiskeli ya kwanza dunia.

Je, unayo taarifa ya kusisimua ambayo ungependa tuichapishe? Tafadhali, wasiliana nasi kupitia news@tuko.co.ke au WhatsaApp: 0732482690.

MAKINIKA: Jinyakulie habari ZINAZOKUFAA ➡️ tafuta “IMEPENDEKEZWA KWA AJILI YAKO” na ufurahie!

Chanzo: TUKO.co.ke"
"Wakati Hofu Kuhusu Akili Bandia Ikitanda Barani, Afrika na China Zaweza Kushirikiana Vipi?","Kutoka kilimo hadi matibabu, akili bandia inabadilisha kila nyanja ya maisha ya binadamu. Hata hivyo, barani Afrika, watu wana maoni tofauti kuhusu akili bandia, na hata hofu ni kubwa zaidi kuliko matarajio. Kwa mujibu wa matokeo ya utafiti uliofanywa na Mfuko wa Lloyd’s Register ambao makao yake makuu yapo mjini London, ni 13% tu ya watu katika Asia Mashariki ambao wanaona kuwa akili bandia ni wazo baya, na karibu 60% ya waliohojiwa wanaipokea sana, mtazamo kama huo pia unabebwa na watu wa Ulaya. Eneo lenye mashaka zaidi kuhusu akili bandia ni Afrika Mashariki, ambako katika nchi kama Tanzania, Kenya na Uganda, zaidi ya nusu ya waliohojiwa wanaamini kuwa teknolojia ya akili bandia inaweza kusababisha madhara.

BWakati hofu kuhusu akili bandia ikitanda Afrika, China na Afrika zinaweza kufanya nini hivyo, barani Afrika, watu wana maoni tofauti kuhusu akili bandia, na hata hofu ni kubwa zaidi kuliko matarajio. Kwa mujibu wa matokeo ya utafiti uliofanywa na Mfuko wa Lloyd’s Register ambao makao yake makuu yapo mjini London, ni 13% tu ya watu katika Asia Mashariki ambao wanaona kuwa akili bandia ni wazo baya, na karibu 60% ya waliohojiwa wanaipokea sana, mtazamo kama huo pia unabebwa na watu wa Ulaya. Eneo lenye mashaka zaidi kuhusu akili bandia ni Afrika Mashariki, ambako katika nchi kama Tanzania, Kenya na Uganda, zaidi ya nusu ya waliohojiwa wanaamini kuwa teknolojia ya akili bandia inaweza kusababisha madhara.

Lakini hali halisi ni kuwa sekta mbalimbali barani Afrika tayari zimeona manufaa ya akili bandia. Katika sekta ya kilimo, Afrika tayari inatumia zana zinazoendeshwa na akili bandia kuchanganua mvua na hali ya udongo na kutoa mashauri yanayotekelezeka kwa wakati, ili kusaidia wakulima kuongeza uzalishaji wa kilimo mashambani. Katika huduma za afya, akili bandia tayari imetumiwa kuwasaidia madaktari kufuatilia kuenea kwa magonjwa ya kuambukiza ili kupunguza vifo vitokanavyo na magonjwa kama vile malaria, kifua kikuu, na kuhara. Na katika benki, teknolojia ya akili bandia inatumiwa kutathmini hali ya biashara ya kampuni ndogo ndogo na kutumia vizuri taarifa hizi kutoa mikopo, na kuleta mabadiliko katika uchumi halisi na kadhalika.

Kwa mtazamo huu, suluhu za akili bandia zina maana kubwa katika bara la Afrika, lakini ukosefu wa fedha kimataifa na uandaaji wa wataalam imekuwa kikwazo kwa maendeleo ya akili bandia barani Afrika. Kutumia nguvu mpya za uzalishaji kuhimiza maendeleo ya taifa ni matokeo muhimu yaliyofikiwa kwenye Mikutano Miwili ya China ya mwaka huu, na kwamba China inaongeza nguvu za uvumbuzi, kulima na kupanua viwanda vinavyoibukia, na kupanga mapema viwanda vya baadaye. Kwa kutumia sayansi, teknolojia na uvumbuzi, mamia ya mamilioni ya watu nchini China wameondokana na umaskini, na China imekuwa nchi ya pili kwa uchumi mkubwa duniani. Hivi sasa China inaunganisha mwelekeo huu mpya wa maendeleo ya kiuchumi katika pendekezo la ""Ukanda Mmoja, Njia Moja"" ili kukuza ustawi wa pamoja kwa binadamu. Afrika itakuwa mnufaika mkubwa wa maendeleo ya China ya nguvu mpya za uzalishaji na kusaidia kutatua changamoto za ukosefu wa ajira, umaskini na ukosefu wa usawa. Katika Kongamano la Maendeleo na Ushirikiano wa Mtandao wa Internet la China na Afrika lililofanyika hivi karibuni, China na Afrika kwa pamoja zilitoa tamko la mwenyekeiti kuhusu ushirikiano katika nyanja mpya za kiteknolojia kama vile akili bandia. Taarifa hiyo imesisitiza kuwa, maendeleo na matumizi ya taarifa za akili bandia yana umuhimu mkubwa kwa nchi nyingi zinazoendelea zikiwemo China na nchi za Afrika. Manufaa ya akili bandia kwa Afrika yatazidi yale ya bara jingine lolote duniani, na kwamba dhana mpya za maendeleo ya China ya kuendeleza nguvu mpya za uzalishaji zinaendana sana na mahitaji ya sasa ya maendeleo ya kiuchumi na kijamii ya Afrika, pamoja na mikakati na maono ya maendeleo katika siku zijazo, hivyo akili bandia italeta fursa mpya na msukumo mpya kwa ushirikiano kati ya China na Afrika. Inaaminika kuwa akili bandia itakuwa mada muhimu katika mkutano wa kilele wa Baraza la Ushirikiano kati ya China na Afrika utakaofanyika Beijing mwaka huu.

Na Hassan Zhou CRI

MAKINIKA: Watumie wahariri wetu taarifa yako unayoiona kuwa bora! Tafadhali wasiliana nasi kupitia news@tuko.co.ke au WhatsApp: 0732482690.

Chanzo: TUKO.co.ke"
"Watu 8 Wafariki, 45 Wajeruhiwa Katika Ajali ya Barabarani Iliyohusisha Lori na Basi la Abiria 53","Maumivu na huzuni zilikumba familia za wafanyikazi 53 wa shambani kufuatia ajali mbaya wakati wa safari yao ya kwenda kazini.

Tukio hilo lilitokea Jumanne, Mei 14, huko Florida Kaskazini, Marekani.

CNN iliripoti kuwa watu wanane walipoteza maisha yao papo hapo, huku wengine zaidi ya 40 wakikimbizwa katika vituo vya matibabu vilivyo karibu, na wengine wanane wakiwa katika hali mbaya.

""Kuna uwezekano mkubwa kwamba hii inaweza kuwa zaidi ya vifo nane kwani baadhi ya waliojeruhiwa, akiwemo dereva wa lori, wako katika hali mbaya sana,"" kikosi cha dharura kilisema.

""Rambirambi na sala zetu ziko kwa familia za marehemu. Sambamba na majukumu yetu, Doria ya Barabara Kuu ya Florida itafanya uchunguzi wa kina kuhusu ajali hiyoya kutisha,"" aliongeza Dave Kerner, mkurugenzi mtendaji wa idara ya usalama wa barabara kuu.

Ni nini kilisababisha ajali ya Florida?

Kulingana na ripoti za polisi, ajali ilihusisha Basi la Kimataifa la 2010 lililokuwa na wafanyikazi wa shamba 53 na Ford Ranger ya 2001.

Magari hayo yaligongana ana kwa ana baada ya Ford Ranger kupoteza mwelekeo.

Mamlaka katika eneo la tukio wanakisia kuwa watu 53 waliohusika wanaweza kuwa wafanyikazi wahamiaji wanaotafuta kazi nje ya nchi ili kulisha familia zao.

""Sisi ni jimbo kubwa la kilimo. Katika msimu huu, huwa tuna wafanyikazi wahamiaji, wakisafiri kwa mabasi kama haya. Watu hawa ni watu wema ambao wamepoteza usaidizi wao wa kimsingi kwa familia zao,"" mwakilishi wa kaunti alisema.

Wakati uo huo, dereva wa lori la kibinafsi la Ford Ranger alikamatwa saa chache baada ya ajali hiyo na kushtakiwa.

Mengi zaidi ya kufuata...

MAKINIKA: Jinyakulie habari ZINAZOKUFAA ➡️ tafuta “IMEPENDEKEZWA KWA AJILI YAKO” na ufurahie!

Chanzo: TUKO.co.ke"
