"Title","Content"
"Magazeti ya Kenya, Mei 23: Mwanamke Atupa Maiti ya Mtoto Wake Katika Boma la Mume wa Zamani Siaya","Mnamo Alhamisi, Mei 23, magazeti ya humu nchini bado yaliendelea kuangazia ziara ya kiserikali ya Rais William Ruto nchini Marekani, lakini yalihifadhi kurasa za siasa za eneo hilo la Mlima Kenya ambako Naibu Rais Rigathi Gachagua sasa anamchumbia aliyekuwa rais Uhuru Kenyatta.

Kurasa za mbele za magazeti ya The Standard na Taifa Leo ya Mei 23, 2024. Picha: Picha za Bongo kutoka The Standard na Taifa Leo.

Chanzo: UGC

Kwingineko, onyesho la kushangaza lilishuhudiwa katika nyumba moja huko Siaya ambapo mke aliyeachana alitupa maiti ya mtoto wake nyumbani kwa mume wake wa zamani.

1. Daily Nation

Gazeti hilo la kila siku liliangazia matukio katika ziara ya kihistoria ya Ruto nchini Marekani.

Ruto alipokelewa na Rais Joe Biden katika Ikulu ya Marekani, Washington, DC, Jumatano, Mei 22.

Marais hao wawili walifanya mkutano wa pande zote ambapo walijadili, miongoni mwa mambo mengine, teknolojia.

Katika taarifa, Ruto aliishukuru serikali ya Marekani kwa kuahidi kuweka rasilimali zaidi katika anga ya kidijitali.

Mnamo Alhamisi, Mei 23, wawili hao watafanya mkutano baina ya nchi hizo mbili, ikifuatwa na hotuba ya pamoja ya wanahabari na baadaye chakula cha jioni cha kitaifa kwa heshima ya Ruto na Mke wa Rais Mama Rachel Ruto.

2. Taifa Leo

Gazeti hilo liliripoti juu ya tukio la kushangaza katika kijiji cha Siaya ambapo mwanamke alibeba mwili wa mtoto wake.

Elizabeth Adhiambo alitembelea nyumba ya mume wake wa zamani huko Kalkada Uradi, ambapo aliwapata wenyeji bila kujua njama yake.

Mzee huyo mwenye umri wa miaka 35 alifika nyumbani hapo jioni ya Jumanne, Mei 21, akiwa amebeba watoto wawili; mvulana, 4, na msichana, 2.

Alimpeleka mvulana huyo aliyeonekana kuwa na usingizi mzito hadi nyumbani kwa mama mkwe wake wa zamani.

Adhiambo aliwadanganya kijana mdogo alikuwa amelala.

Kisha aliondoka nyumbani kwa bodaboda iliyokuwa imempeleka yeye na watoto pale.

“Waliachana na mumewe na kuondoka na watoto, alikuja nao na kuwaacha nyumbani kwa bibi yao, alipofika alituambia kijana amelala fofofo na kumuacha kwenye siti, kisha akaomba radhi. kwa simu kabla hatujamuona akiruka pikipiki na kuondoka,"" dadake aliyekuwa mume wa Adhiambo alifichua Taifa Leo.

Kurudi nyumbani, mama mkwe wa zamani wa Adhiambo alienda kumchukua mvulana huyo 'aliyekuwa na usingizi' ili alale alipojua kwamba alikuwa amekufa kwa muda mrefu.

Familia iliwasiliana na polisi ambao walifika nyumbani na kupata mwili ukiwa chini.

Ilipelekwa katika chumba cha kuhifadhi maiti cha Hospitali ya Rufaa ya Kaunti ya Siaya kabla ya uchunguzi wa maiti.

3. The Standard

Gazeti la Standard liliangazia matukio katika eneo la Mlima Kenya ambapo machafuko ya kisiasa yameshuhudiwa katika siku za hivi karibuni.

Naibu Rais Rigathi Gachagua amekuwa akikabiliwa na upinzani kutoka kwa wanasiasa wengi wa eneo hilo ndani ya muungano wa Kenya Kwanza.

Licha ya mwenendo mpotovu wa kisiasa wa vijana wake, Gachagua amethibitishwa kuhusu wito wake wa kutaka umoja wa Mlima Kenya.

Kivutio kikuu cha matukio ya kisiasa katika eneo hili kilikuwa tawi la mzeituni la Gachagua kwa rais wa zamani Uhuru Kenyatta.

Uhuru na Gachagua wamekuwa hawaonani macho kwa macho kisiasa kwa muda mrefu zaidi, huku naibu rais akimlaumu Uhuru kwa changamoto za kijamii na kiuchumi ambazo Kenya imekuwa ikikabiliana nazo.

Kwa muda, naibu rais alikuwa na imani kwamba enzi ya Uhuru ilivuruga nchi, hadi hivi majuzi ambapo yeye (Gachagua) alionekana kuwa amebadilika.

Gachagua aliteta na aliyekuwa rais mnamo Jumanne, Mei 21, alipokuwa akiwahutubia wakazi wa mji wa Kianyaga, kaunti ya Kirinyaga.

Huku akitoa mwaliko wake kwa Uhuru, Gachagua alibainisha umuhimu wa viongozi wote kutoka eneo hilo kuja pamoja wakati huu, bila kujali itikadi zao za kisiasa.

Kutokana na Uhuru kuwa mzaliwa wa Mlima Kenya, Gachagua alidokeza kuwa wakati ulikuwa umewadia kwake kujitokeza kusaidia katika kuainisha mkondo wa kisiasa wa eneo hilo.

Katika azimio lake jipya, Gachagua aliapa kutopigana na wenyeji wenzake wa Mlima Kenya, huku akikiri kuwa machafuko ya kisiasa yanashuhudiwa katika eneo hilo.

Alidai vikosi vya nje ndivyo vinavyozua mifarakano kati ya wapiga kura wa Mlima Kenya.

Kwa ajili hiyo, aliapa kutokabiliana na 'kaka au dada' kutoka mlimani.

4. People Daily

Gazeti hilo liliokoa nafasi kwa masaibu yanayomkabili afisa mkuu mtendaji wa Hospitali ya Kitaifa ya Kenyatta (KNH) Dkt Evanson Kamuri.

Tume ya Maadili na Kupambana na Ufisadi (EACC) ilipata maagizo kutoka kwa mahakama ya kufungia akaunti za benki za Kamuri wakati wa uchunguzi wa madai ya ufisadi dhidi ya Mkurugenzi Mtendaji.

Kamuri anashtakiwa kwa kupanga ufisadi na uhalifu wa kiuchumi kwa KSh 634 milioni.

Wachunguzi wa shirika la kupambana na ufisadi walipewa uhuru wa kuchunguza akaunti mbili za benki zilizokuwa na jina la Kamuri.

Wangechunguza hati asili za kufungua akaunti, vitabu vya benki, hundi halisi, kadi za mamlaka, hati za miamala, uidhinishaji wa malipo, fomu kubwa za miamala na taarifa za kuanzia 2019 hadi sasa.

Kulingana na EACC, Kamuri alikuwa amejilimbikizia mali ambayo haikulingana na chanzo chake halali cha mapato.

Read ENGLISH VERSION

Je, unayo taarifa ya kusisimua ambayo ungependa tuichapishe? Tafadhali, wasiliana nasi kupitia news@tuko.co.ke au WhatsApp: 0732482690.

MAKINIKA: Jinyakulie habari ZINAZOKUFAA ➡️ tafuta “IMEPENDEKEZWA KWA AJILI YAKO” na ufurahie!

Chanzo: TUKO.co.ke"
"Raila Odinga Awatetea Viongozi wa Azimio Kwenye Ziara ya Ruto Marekani: ""Ni Mwaliko Sio Kujipeleka""","Nairobi—Kinara wa ODM Raila Odinga amejibu wasiwasi wa Wakenya baada ya baadhi ya viongozi wa upinzani kuandamana na Rais William Ruto hadi Marekani.

Kumekuwa na maoni tofauti baada ya viongozi wakuu wa upinzani, akiwemo Kiongozi wa Wachache Opiyo Wandayi na Gavana Gladys Wanga, kuungana na Ruto katika ziara yake ya siku 3 nchini Marekani.

Kiongozi huyo wa ODM, hata hivyo, aliwatetea viongozi wa Azimio nchini Marekani, akisema kuwa serikali ya Marekani iliwaalika.

Katika taarifa, Raila alisema viongozi hao wana ruhusa yake na ya uongozi mzima wa Azimio kuungana na rais katika misheni yake kwa maslahi ya taifa la Kenya.

“Odinga anapenda kufafanua kwamba viongozi wote wa Azimio walioandamana na rais walialikwa na serikali ya Marekani na wana kibali chake na cha muungano kuungana na rais katika misheni hii, kwa mujibu wa utamaduni uliowekwa wa kidemokrasia na maslahi mapana ya taifa la Kenya, kwamba Azimio. inasimamia,” Raila alisema kwenye taarifa iliyotumwa kwenye vyumba vya habari.

Mkuu huyo wa upinzani alisema hakuna jambo jipya kuwa na wajumbe wa pande mbili kuandamana na rais, akihoji kuwa hata rais wa zamani Barack Obama alikuwa na mjumbe wa Jamhuri wakati wa ziara yake nchini Kenya.

""Ujumbe wa pande mbili unaenda sambamba na wajumbe sawa na viongozi wa juu wa Marekani nchini Kenya, ikiwa ni pamoja na ziara ya Kenya ya Rais wa wakati huo wa Marekani, Barack Obama, ambayo ilikuwa na viongozi wa Congress na Republican. Katika miaka ya kati, wajumbe zaidi wa pande mbili kutoka Marekani wamekuwa. alitembelea Kenya,” aliongeza.

Kiongozi huyo wa Azimio aliwataka viongozi wa upinzani wanaoandamana na Ruto kutumia fursa hiyo kusaidia Marekani kuangazia masuala ambayo yanawahusu Wakenya wengi ikiwemo kupambana na ufisadi.

“Odinga anautaka ujumbe huo kutumia fursa hii kuisaidia Marekani kuangazia masuala ambayo yanawahusu watu wengi zaidi wa Kenya, ikiwa ni pamoja na kuongezeka kwa biashara na uwekezaji, fursa bora za huduma za afya ndani ya nchi, kupambana na rushwa, kutengeneza ajira na kupata taarifa. na vijana,"" kiongozi huyo wa ODM alisema.

Read ENGLISH VERSION

Je, unayo taarifa ya kusisimua ambayo ungependa tuichapishe? Tafadhali, wasiliana nasi kupitia news@tuko.co.ke au WhatsApp: 0732482690.

Chanzo: TUKO.co.ke"
"Wakenya Washangaa Aliko Charlene Ruto Dada Zake Wakijivinjari Katika Zuara ya Marekani: ""Yuko Wapi?""","Rais William Ruto, mkewe Rachel na watatu kati ya mabinti zao sita walijitokeza wakiwa wamevalia mavazi maridadi walipotembelea Studio za Tyler Perry

Familia hiyo iko Marekani katika ziara ya kiserikali ambapo walikutana na watu mashuhuri kadhaa, akiwemo mtangazaji Steve Harvey na nguli wa mpira wa vikapu Shaquille O'Neal

Wakenya waligundua Charlene, bintiye rais ambaye ni kipenzi cha wengi hakuwa nao na walikuwa na wasiwasi kuhusu aliko

Wakenya wamejitokeza kwenye mitandao ya kijamii kuuliza maswali kuhusu aliko Charlene Ruto baada ya kugundua hayupo na wenzake katika familia.

Rais William Ruto, mkewe Rachel, na binti zao June (kushoto), Stephanie (katikati ya Ruto na Rachel), na Cullie (kulia). Picha: Mpasho.co.ke.

Chanzo: UGC

Charlene Ruto yuko wapi?

Rais William Ruto, mkewe, Rachel, na binti zao warembo, June, Stephanie, na Cullie, kwa sasa wako katika ziara ya kiserikali nchini Marekani.

Picha za familia ya rais katika Studio ya Tyler Pery huko Atlanta, Georgia, zilisambaa kwenye mitandao ya kijamii, na Wakenya haraka wakagundua kuwa Charlene hayupo nao.

Dada za Charlene, June, Stephanie na Cullie, walitamba katika mavazi ya kupendeza wakati wa ziara hiyo.

Hapa chini ni maoni kutoka kwa Wakenya baada ya Charlene kukosa kuandamana na familia yake.

Recy Remish alisema:

""Mwanamitindo wetu Charlene yuko wapi?""

Laura Chebet aliuliza:

""Wapi binti yetu kipenzi?""

Clemo Clemo alisema:

""Charlene atokee awache kujificha.""

Bellice_clothing alisema:

""Hawakubeba Charlene?

William Ruto aliomba msamaha kwa mmoja wa binti zake baada ya kuzuru Studio za Tyler Perry huko Atlanta.

Picha za familia hiyo katika Studio ya Tyler Pery huko Atlanta, Georgia, zilisambaa kwenye mitandao ya kijamii, na Wakenya haraka wakagundua kuwa Charlene hayupo.

Kulingana na Waziri la Biashara (CS) Rebecca Miano, Kenya itawasilisha zaidi ya mawazo 30 ya biashara kwa wawekezaji watarajiwa ili kufunga mikataba yenye thamani ya zaidi ya $20.5 bilioni (KSh 2.69 trilioni).

Read ENGLISH VERSION

Je, unayo taarifa ya kusisimua ambayo ungependa tuichapishe? Tafadhali, wasiliana nasi kupitia news@tuko.co.ke au WhatsApp: 0732482690.

MAKINIKA: Jinyakulie habari ZINAZOKUFAA ➡️ tafuta “IMEPENDEKEZWA KWA AJILI YAKO” na ufurahie!

Chanzo: TUKO.co.ke"
"Mama ya Binti wa MKU Aliyeuawa Alia Kwa Uchungu Mochwari Akiutizama Mwili, Amwita Jina: ""Faith""","Faith Musembi, mwanafunzi wa chuo kikuu mwenye umri wa miaka 19, alidaiwa kuuawa na watekaji nyara zaidi ya wiki mbili zilizopita

Mapema leo, Jumatano, Mei 22, mamake Faith aliutazama mwili wake katika Mazishi ya Machakos na kulemewa na huzuni

Mama alipiga kelele na kuita jina la Faith akitarajia angeamka huku wanafamilia wakimfariji; mwanadada anazikwa leo

Mama wa mwanafunzi wa chuo kikuu mwenye umri wa miaka 19 ambaye alidaiwa kuuawa na watekaji nyara muda wa wiki mbili zilizopita ameutazama mwili wake katika chumba cha kuhifadhia maiti kwa uchungu.

Familia ya Faith haikufarijiwa walipouchukua mwili wake kwa mazishi. Picha: Frakida Media.

Chanzo: UGC

Faith Musembi, ambaye alikuwa mjamzito wakati wa kifo, aliuawa na watekaji nyara wake, ambao walikuwa wamedai fidia kutoka kwa familia yake.

Mamake msichana huyo alishindwa kuzuia machozi yake, mapema leo Jumatano, Mei 22, akitazama mabaki yake kabla ya mazishi yanayoendelea katika kaunti ya Machakos.

Wakiwa katika Mazishi ya Machakos, mamake Faith, ambaye alikuwa akifarijiwa na familia na marafiki, alilia kwa uchungu alipouona mwili wa bintiye.

MAKINIKA: Watumie wahariri wetu taarifa yako unayoiona kuwa bora! Tafadhali wasiliana nasi kupitia news@tuko.co.ke au WhatsApp: 0732482690.

Aliita jina la binti yake bila msaada, akitumaini angeweza kuamka, na alilia kwa uchungu huku watu wa familia yake wakimshikilia.

""Faith! Faith!"" aliita huku akilia na kukosa utulivu.

Waombolezaji wengine waliokuwepo pia walimuombea apate nguvu alipokuwa akimlaza bintiye.

Nani alimuua Faith Musembi?

Kama ilivyoripotiwa awali, Faith aliuawa Jumatano, Mei 8, katika Jumba la Majaribio la Thika mjini.

Watesaji wake walikuwa wamedai fidia ya zaidi ya KSh 27,000 kabla ya kumuua, babake Boniface Musembi alifichua.

Musembi alieleza kuwa washukiwa hao walitumia simu ya bintiye wakitoa madai yao.

Mwili wa marehemu ulisafirishwa hadi katika chumba cha kuhifadhia maiti cha Hospitali ya General Kago, ambako uchunguzi ulifanyika, ambaye ripoti yake ilionyesha kuwa Faith alifariki kutokana na kuvuja damu nyingi.

Mpenzi wa Faith Musembi akamatwa

Siku chache baada ya kifo chake, mpenzi wake alikamatwa huko Homa Bay.

Kulingana na Lawrence Muchangi, kamanda wa polisi wa Kaunti Ndogo ya Thika, anaaminika kuwa na uhusiano na Faith kwa miaka mingi.

Wakati uchunguzi ukiendelea, mshukiwa bado anazuiliwa katika kituo cha polisi.

Read ENGLISH VERSION

Je, unayo taarifa ya kusisimua ambayo ungependa tuichapishe? Tafadhali, wasiliana nasi kupitia news@tuko.co.ke au WhatsApp: 0732482690.

MAKINIKA: Jinyakulie habari ZINAZOKUFAA ➡️ tafuta “IMEPENDEKEZWA KWA AJILI YAKO” na ufurahie!

Chanzo: TUKO.co.ke"
"Picha za Starehe Ndani ya Ndege ya VIP Yenye Chumba cha Kulala Ambayo Ruto Alitumia Kuelekea US","Ziara ya kitaifa ya Rais William Ruto nchini Marekani inaashiria ziara ya kwanza ya rais wa Kenya nchini Marekani katika kipindi cha miaka ishirini

Tofauti na safari yake ya kawaida kwa ndege rasmi ya rais wa Kenya, Fokker 70 ER, Rais Ruto alichagua A6 RJU BBJ kubwa na ya kisasa zaidi kwa safari hii

William Ruto analenga kuvutia uwekezaji mkubwa nchini Kenya, na mipango ya msafara wake kuwasilisha mawazo zaidi ya 30 ya biashara kwa wawekezaji watarajiwa wakati wa ziara yake

Rais wa Kenya William Ruto ameanza rasmi ziara yake ya kiserikali nchini Marekani, ambapo atakutana na mwenzake wa Marekani, Joe Biden, mjini Washington wiki hii.

Rais William Ruto aliwasili Marekani kwa ziara ya kihistoria ndani ya ndege ya A6 RJU BBJ. Picha: @StateHouseKenya/RoyalJet.

Chanzo: UGC

Ziara hiyo imetajwa kuwa ya ""kihistoria"" na ofisi ya Ruto, ikiwa ni ziara ya kwanza ya kiserikali ya rais wa Kenya nchini Marekani katika miongo miwili na ya kwanza kufanywa na kiongozi wa Afrika tangu 2008.

Jinsi Ruto alivyosafiri hadi Marekani

Nchini Kenya, Rais William Ruto kwa kawaida husafiri kwa ndege rasmi ya rais, Fokker 70 ER, ambayo ilinunuliwa mwaka wa 1995 na inaendeshwa na Jeshi la Anga la Kenya.

Hata hivyo, kwa ziara yake nchini Marekani, Rais Ruto alichagua kutotumia simu ya kawaida ya Fokker 70 ER.

Badala yake, alisafiri kwa A6 RJU BBJ (Boeing Business Jet), ndege kubwa zaidi kuliko ndege ya kawaida ya rais.

Rais William Ruto na mkewe, Rachel Ruto, waliwasili Marekani kwa kutumia A6-RJU BOEING BBJ. Picha: @StateHouseKenya.

Chanzo: UGC

Ndege ya kibinafsi anayotumia Ruto inamilikiwa na kuendeshwa na Kundi la RoyalJet, ambao walitaja ndege hiyo kama mojawapo ya ndege mpya zaidi katika meli zao, ikiwa imeongezwa mpya kutoka kiwandani mwaka wa 2017.

Kampuni ya RoyalJet ina makao yake makuu Abu Dhabi, Falme za Kiarabu.

Ndani ya A6 RJU BBJ Ruto anaitumia kwa ziara ya serikali ya Marekani. Picha: RoyalJet.

Chanzo: UGC

Maelezo kuhusu A6 RJU BBJ

Usanidi - Viti 34 pamoja na Chumba cha kulala (mbele); 8 VIP, 8 Biashara, 18 Standard

Muda - Zaidi ya masaa 10

Uwezo wa mizigo - Inachukua masanduku 50-80, kulingana na uzito na ukubwa

Burudani - Mfumo wa IFE unaohitajika kwa video, mfumo wa sauti wa hali ya juu na spika za juu na subwoofers, onyesho la Ramani ya Dunia

Muunganisho - Ka-Band WiFi, Simu ya GSM, Simu ya Satellite ya Kabati, huduma ya Faksi

Vipengele vingine - Iliyorekebishwa kwa urefu wa chini wa cabin, iliyo na mfumo wa kuchuja wa HEPA

Jinsi Kenya itafaidika na ziara ya William Ruto Marekani

Ilivyoripotiwa awali na TUKO.co.ke, wakati wa ziara ya serikali ya Ruto nchini Marekani (Marekani) mnamo Alhamisi, Mei 23, Kenya itatafuta kuvutia matrilioni ya shilingi katika uwekezaji.

Mazungumzo ya biashara na maonyesho ya biashara yanatarajiwa kuchukua hatua kuu wakati wa safari ya wiki nzima.

Kulingana na Katibu wa Baraza la Mawaziri la Biashara (CS) Rebecca Miano, Kenya itawasilisha zaidi ya mawazo 30 ya biashara kwa wawekezaji watarajiwa kwa lengo la kufunga mikataba yenye thamani ya zaidi ya $20.5 bilioni (KSh 2.69 trilioni).

Zaidi ya hayo, katika ziara hiyo, chapa mbili za Kenya, Vivo Fashion na Wazawazi, zitafungua maduka katika masoko ya Marekani.

Read ENGLISH VERSION

Je, unayo taarifa ya kusisimua ambayo ungependa tuichapishe? Tafadhali, wasiliana nasi kupitia news@tuko.co.ke au WhatsApp: 0732482690.

MAKINIKA: Jinyakulie habari ZINAZOKUFAA ➡️ tafuta “IMEPENDEKEZWA KWA AJILI YAKO” na ufurahie!

Chanzo: TUKO.co.ke"
"Mwanamke Amuua Mumewe kwa Kisu Akiwa Usingizini, Aficha Maiti Chumbani kwa Siku 2","Wilaya ya Mukono ilitumbukia kwenye simanzi baada ya mkazi mmoja kupatikana ameuawa katika makazi yake kijiji cha Katikamu

Mshukiwa mkuu, Ruth Musimenta, alikiri kuhusika na madai ya mauaji ya James Nsubuga, mumewe

Polisi walipata kisu ambacho kinadaiwa kutumika katika mauaji hayo na kufichwa kwenye chumba cha kulala cha wanandoa hao

Uganda - Wakaazi wa wilaya ya Mukono walishangazwa baada ya mwanamume mmoja kudaiwa kuuawa akiwa usingizini na mkewe mwenye umri wa miaka 30.

Polisi wa Uganda wakiwa katika eneo la uhalifu lililopita (Picha kwa kielelezo). Tukio hilo limetokea wilayani Mukono. Picha: Badru Katumba.

Chanzo: Getty Images

Inadaiwa Ruth Musimenta alimchoma kisu shingoni James Nsubuga na kusababisha kifo chake.

Tukio hilo la kusikitisha lilitokea Jumamosi, Mei 18, katika makazi yao katika kijiji cha Katikamu.

Kama ilivyoripotiwa na Monitor, Fred Enanda, msemaji wa polisi, alifichua kuwa Musimenta alimfungia mumewe chumbani kwao kwa siku kadhaa na alipanga mpango wa kuutupa mwili wake.

MAKINIKA: Watumie wahariri wetu taarifa yako unayoiona kuwa bora! Tafadhali wasiliana nasi kupitia news@tuko.co.ke au WhatsApp: 0732482690.

“Nsubuga alichomwa kisu na mkewe shingoni akiwa usingizini hali iliyopelekea kifo chake. Mtuhumiwa aliuweka mwili huo chumbani kwa siku mbili hadi ulipotolewa na polisi. Maafisa walipata kisu kinachohisiwa kutumika kwenye chumba cha kulala. Buti mbili za jeshi na bastola zilipatikana,” alisema.

Enanga pia alifichua kuwa Musimenta alikiri kosa la kumuua mumewe na atafikishwa mahakamani kujibu mashtaka ya mauaji.

Uchunguzi wa polisi unaonyesha kuwa mshukiwa na marehemu walikuwa na uhusiano wenye misukosuko, ambao hatimaye uliishia kwenye kisa hicho cha kutisha.

Mwanamke awalipa majambazi wamuue mumewe kwa kuchepuka

Katika hadithi nyingine, mwanamke alikamatwa kwa kuwalipa majambazi wamuue mumewe kufuatia ugomvi wa kinyumbani.

Njama ya kumuua mwanamume huyo iliafikiwa baada ya wanandoa hao kupoteza mtoto wao mchanga na mtoto aliye tumboni na kusababisha marehemu kufichua mipango ya kuoa mke wa pili, kwa mujibu wa polisi.

Mwanamke huyo alikiri, akisema kwamba aliwapa wahuni hao watatu KSh 105,000 baada ya mumewe aliyefariki kumdhihaki mara kwa mara kwa kuzemba kitandani.

Read ENGLISH VERSION

Je, unayo taarifa ya kusisimua ambayo ungependa tuichapishe? Tafadhali, wasiliana nasi kupitia news@tuko.co.ke au WhatsApp: 0732482690.

MAKINIKA: Jinyakulie habari ZINAZOKUFAA ➡️ tafuta “IMEPENDEKEZWA KWA AJILI YAKO” na ufurahie!

Chanzo: TUKO.co.ke"
"Joe Biden Ampokea William Ruto Ikulu ya White House Anapofanya Ziara ya Kihistoria ya Kiserikali","Mnamo Jumatano, Mei 22, Rais William Ruto alianza rasmi ziara yake ya kiserikali ya siku tatu nchini Marekani

Rais Joe Biden alimpa Ruto na timu yake hafla ya kuwakaribisha katika Ikulu ya White House

Viongozi hao wawili wa nchi baadaye walifanya mkutano wa pande zote kuhusu teknolojia, ambao Ruto aliutaja kama msingi wa ushirikiano wa muda mrefu

Rais William Ruto amewasili katika Ikulu ya Marekani, Washington, DC, huku akiendelea na ziara yake ya kihistoria ya siku tatu nchini Marekani.

Rais Joe Biden alimkaribisha William Ruto katika Ikulu ya White House. Picha: William Ruto.

Chanzo: Twitter

Mnamo Jumatano, Mei 22, Rais Joe Biden alimpokea Ruto katika Ikulu ya White House kwa ziara hiyo ya kihistoria.

Walipowasili, viongozi hao wawili walifanya mkutano wa meza ya pande zote kuhusu teknolojia.

Kile ambacho Ruto na Biden walijadili katika Ikulu

Katika taarifa, Ruto aliishukuru serikali ya Marekani kwa kuahidi kuweka rasilimali zaidi katika anga ya kidijitali.

""Hakuna ushirikiano ulio na thamani kama ule unaozingatia teknolojia. Kenya inathamini ishara nzuri ya Marekani ya kuweka rasilimali zaidi katika anga ya kidijitali kupanua fursa na kubadilisha maisha sio tu nchini Kenya bali pia katika bara letu.

""Alijiunga na Rais wa Marekani Joe Biden katika Ikulu ya Marekani, Washington, D.C., kwa meza ya teknolojia,"" Ruto alisema.

Alhamisi, Mei 23, fanya mkutano baina ya nchi hizo mbili, ikifuatiwa na hotuba ya pamoja ya wanahabari na chakula cha jioni cha kitaifa kwa heshima ya Ziara ya Kiserikali ya Rais Ruto na Mke wa Rais Mama Rachel Ruto nchini Marekani.

Read ENGLISH VERSION

Je, unayo taarifa ya kusisimua ambayo ungependa tuichapishe? Tafadhali, wasiliana nasi kupitia news@tuko.co.ke au WhatsApp: 0732482690.

MAKINIKA: Jinyakulie habari ZINAZOKUFAA ➡️ tafuta “IMEPENDEKEZWA KWA AJILI YAKO” na ufurahie!

Chanzo: TUKO.co.ke"
"Cheruiyot Kirui: Wakenya Wamwombea Mfanyakazi wa Benki Aliyeripotiwa Kutoweka Akiukwea Mlima Everest","Cheruiyot Kurui alianza safari hatari ya kupanda Mlima Everest bila oksijeni ya ziada

Hata hivyo, mfanyakazi wa benki na mwelekezi wake waliripotiwa kutoweka kabla ya kufika kilele cha mlima

Habari hizo ziliwatia hofu Wakenya baadhi wakaanza kusali huku wengine wakisimulia visa vya kutisha kuhusu Everest

Mfanyakazi katika benki moja nchini Kenya, Cheruiyot Kirui, alitoweka alipokuwa akijaribu kuukwea Mlima Everest bila kutumia oksijeni ya ziada.

Juhudi za kumtafuta Cheruiyot Kirui zinaendelea. Picha: Westend61/Getty Images na @C_NyaKundiH.

Chanzo: UGC

Je, Cheruiyot Kirui alipotea vipi kwenye Mlima Everest?

Kulingana na waandalizi wa msafara huo, Kirui na mwelekezi wake walipotea katika eneo la 'death zone' (zaidi ya mita 8,000) kwenye Everest mnamo Mei 22, 2024.

Akizungumza na gazeti la Himalayan Times, mwenyekiti wa Seven Summit Treks Mingma Sherpa alisema waandalizi walipoteza mawasiliano na Kirui katika Bishop Rock, mita chache tu chini ya mlima.

MAKINIKA: Watumie wahariri wetu taarifa yako unayoiona kuwa bora! Tafadhali wasiliana nasi kupitia news@tuko.co.ke au WhatsApp: 0732482690.

Sherpa alisema Seven Summit Treks imewatuma waokoaji wawili kumtafuta Kirui na kiongozi wake.

""Kirui, mfanyakazi wa benki anayefanya kazi na KCB, na mwelekezi wake Sherpa Nawang walipatikana mara ya mwisho huko Bishop Rock. Wao (waokoaji) wamefika juu ya eneo la kilele,"" alisema Sherpa.

Wakijibu habari za kutoweka kwa Kirui, wanamtandao waliwataka Wakenya kumuombea apatikane akiwa salama.

Storm:

""Kwa sababu alitoweka akiwa katika eneo hatari, nina shaka sana kama atawahi kupatikana hai. Katika Mlima Everest kumetapakaa miili ya watu waliokufa waliokuwa wakijaribu kuiteka Everest.""

Aamedi:

""Pole sana kwa hilo. Hilo ni tukio hatari. Namuombea.""

M:

""Kila mwaka, mamia ya watu hufa kwenye Mlima Everest. Urefu uliokithiri, hali ya hewa isiyotabirika, na ardhi mbaya inaweza kusababisha matokeo mabaya, na kuifanya kuwa jambo la hatari. Ni ukumbusho wa kutisha wa nguvu kubwa za asili. Natumai atapatikana.""

Ngulini:

""Wakati mwingine ushindi mkubwa ni hekima ya kurudi nyuma.""

Kim:

""Kulingana na jamii ya wapanzi miti, hadi sasa, inakadiriwa watu 300 wamekufa wakipanda Mlima Everest, na takriban miili 200 bado kwenye mlima. Baadhi ya walioaga wanaonekana mlimani, na wengine wamepotea milele"".

Vincent Bett:

""Wah! Nimetazama filamu za Mlima Everest, na inatisha.""

David Tuey:

""Mlima Everest ni mahali ambapo miili ya binadamu kama vile buti za Kijani, mgongo mwekundu, na kofia za njano hutumiwa kuashiria njia na njia.""

Benson Kathenge:

""Everest si mzaha. Tazama filamu halisi kuhusu mlima huo.""

Read ENGLISH VERSION

Je, unayo taarifa ya kusisimua ambayo ungependa tuichapishe? Tafadhali, wasiliana nasi kupitia news@tuko.co.ke au WhatsApp: 0732482690.

MAKINIKA: Jinyakulie habari ZINAZOKUFAA ➡️ tafuta “IMEPENDEKEZWA KWA AJILI YAKO” na ufurahie!

Chanzo: TUKO.co.ke"
